Daisy Austin, 20000182, DS, striving for world domination,hunting demons,solving mysteries,piloting a spaceship,maintaining salon-quality hair,campaigning for social causes,hunting demons,promoting capitalism,being condescending to customers,blowing bubbles
Melissa Alexander, 20000160, CS, whining at umpires,making political gaffes,creating an axis of evil,making witty remarks,cooking dinners,crushing dissent,enjoying ball-room dancing,fighting for democracy,over-acting,cross-dressing in women's clothes
Guillermo Hawkins, 20000433, CS, campaigning for social causes,throwing TVs out of the windows,winning boxing matches,running a kingdom,drawing whimsical cartoons,promoting open-source software,designing clothes,running a media empire,writing horror stories,singing rock songs
Neil Francis, 20000481, CS, avoiding taxes,shilling for rental car companies,singing pop songs,devising evil schemes,studying science,living amongst apes,campaigning for social causes,knocking out opponents,punishing crime,performing household chores
Claude Curry, 20000200, CS, manipulating political pawns,promoting communism,selling fast food,designing clothes,enriching uranium,promoting circus attractions,drawing whimsical cartoons,leading revolts,running a crime family,running an empire
Janice Lewis, 20000014, CS, campaigning for social causes,healing the sick,promoting conservative values,spreading political gossip,racking up marriages,over-acting,teaching philosophy,singing Hipbop songs,writing modern fiction,starring in sit-coms
Jeremy Gonzales, 20000016, CS, promoting circus attractions,ranting about liberals,writing hawkish memos,doing slapstick comedy,insulting minorities,eluding the public gaze,starring in romantic comedies,competing in the Olympics,developing cunning plans,manipulating political pawns
Tina Griffin, 20000138, CS, building airplanes,making science fiction movies,ordering wire-taps,doing stand-up,singing torch songs,writing modern fiction,cross-dressing in women's clothes,playing drums,selling cosmetics,developing cunning plans
Justin White, 20000058, CS, campaigning for social causes,interpreting evidence,selling comic books,directing action movies,surviving fatwas,preventing crime,building houses for poor people,betraying friends,hiding from the public,running restaurants
Brett Haynes, 20000176, CS, solving crimes,chain-smoking Gauloises Bleues,recording pop songs,winning tennis tournaments,blanketing staff with memos,campaigning for social causes,teaching philosophy,searching for the messiah,test-driving cars,making cartoons
Rebecca Dennis, 20000440, CS, selling out,shilling for rental car companies,starring in musical comedies,leading revolts,running an empire,promoting conservative values,building houses for poor people,launching cultural revolutions,selling cheap airline seats,crushing dissent
Pamela Parker, 20000078, CS, studying science,punishing crime,promoting conservative values,promoting circus attractions,organizing a putsch,offering gnostic advice,whining at umpires,cross-dressing in women's clothes,making violent movies,selling fast food
Cheryl Wells, 20000193, CS, podcasting about movies,promoting conservative values,seducing women,postulating bizarre theories,starring in Hollywood movies,selling cheap airline seats,winning heavyweight titles,producing Hipbop records,leading revolts,bugging political rivals
Jasmin Chadwick, 20000279, CS, selling out,selling franchises,searching for a new world,winning heavyweight titles,seducing women,doing stand-up,tending the garden,ranting about liberals,developing operating systems,knocking out opponents
Willette Rudd, 20000323, CS, gyrating hips,instigating rebellion,interviewing celebrities,singing pop songs,promoting conservative values,blanketing staff with memos,writing pop songs,arresting criminals,promoting conservative values,writing hawkish memos
Nicole Johnson, 20000096, DS, performing household chores,slashing victims,gadding about town,fighting in gladiator arenas,playing quidditch,piloting a spaceship,terrorizing sleepers,expressing violent urges,singing pop songs,clipping coupons
Indira Savage, 20000287, CS, teaching philosophy,scandalizing polite society,making witty remarks,promoting circus attractions,interpreting evidence,surviving large-scale floods,promoting conservative values,hiding from the public,racking up marriages,speaking with funny accents
Joesph Rich, 20000300, CS, studying linguistics,winning tennis tournaments,leading revolts,chain-smoking Gauloises Bleues,making violent movies,stabbing in the back,running a bureaucracy,starring in Hollywood movies,teaching philosophy,stabbing in the back
Gerard Singleton, 20000110, DS, instigating rebellion,brewing magican potions,studying magic tricks,solving crimes,solving crimes,hunting demons,offering legal advice,killing demons,cross-dressing in women's clothes,talking to mirrors
Ellyn Towns, 20000326, DS, launching hostile takeovers,maintaining salon-quality hair,promoting science,subverting social conventions,singing country music,winning heavyweight titles,foiling the schemes of evil villains,promoting mysticism,brewing magican potions,making lewd remarks
Christopher Foster, 20000084, CS, developing open-source software,writing pop songs,drawing whimsical cartoons,shilling for rental car companies,making unauthorized sex tapes,selling fast food,womanizing,singing torch songs,building houses for poor people,writing purple prose
Janine Albert, 20000340, CS, campaigning for social causes,making subversive art,hiding from the public,racking up marriages,starring in romantic comedies,dating centrefolds,starring in sit-coms,making dunk shots,ranting about liberals,singing pop songs
Rachel Nelson, 20000087, CS, throwing TVs out of the windows,writing for the New Yorker,interpreting evidence,promoting circus attractions,healing the sick,podcasting about movies,singing pop songs,running the FBI,recruiting dissidents,promoting pacifism
Sandi Merritt, 20000353, DS, collecting comic books,playing poker badly,foiling the schemes of evil villains,brewing magican potions,offering legal advice,promoting logical thinking,promoting the Dark Side,pioneering new technologies,pioneering new technologies,defending the weak
Ignacia Foreman, 20000256, DS, solving crimes,hunting demons,devising evil schemes,promoting capitalism,developing new technologies,performing kung-fu moves,running a business empire,engaging in bare-knuckle fighting,hunting monsters,being condescending to customers
Lashon Stiles, 20000295, DS, counting calories,studying science,playing soccer,keeping accounts,playing pop music,fighting with swords,selling out,interviewing celebrities,driving under the influence,solving mysteries
Elsa Hayes, 20000169, CS, solving crimes,issuing threats,avoiding taxes,teaching the next generation,leading armies into battle,fighting for civil rights,creating an axis of evil,fighting for democracy, fighting for democracy,starring in romantic comedies
Willie Adams, 20000040, DS, ruling over subjects,killing monsters,turning it up to 11,hunting demons,clipping coupons,making science fiction movies,directing movies,promoting democracy,offering legal advice,solving crimes
Indira Savage, 20000287, CS, drawing whimsical cartoons,tending the garden,searching for the messiah,interpreting evidence,campaigning for social causes,running a movie studio,preventing crime,leading armies into battle,ranting about liberals,ranting about liberals
Gene Ramon, 20000372, CS, leading revolts,promoting conservative values,cooking dinners,wielding political power,performing household chores,launching cultural revolutions,stabbing in the back,building houses for poor people,opening a new front,investing money
Roger Roberts, 20000021, CS, writing serialized stories,making witty remarks,punishing crime,foiling the schemes of evil villains ,promoting world peace,fighting for democracy,writing TV comedies,eluding the public gaze,managing hedge funds,betraying friends
Helen Young, 20000020, DS, doing slapstick comedy,promoting American values,flying into a rage,analyzing intelligence data,solving mysteries,performing magic tricks,promoting capitalism,spouting movie trivia,battling the forces of darkness,keeping accounts
Drema Saylor, 20000376, DS, protecting criminals,solving crimes,fighting in gladiator arenas,finding clues,running a multinational corporation,working for the forces of darkness,subverting social conventions,ruining an empire,spying for the enemy,singing bawdy songs
Annmarie Toney, 20000393, CS, commiting perjury,promoting Scientology,making vulgar jokes,performing household chores,over-acting,wielding political power,developing operating systems,promoting vegetarianism,making lewd remarks,knocking out opponents
Kimberli Whatley, 20000396, CS, studying science,wielding political power,singing pop songs,launching cultural revolutions,promoting conservative values,scandalizing polite society,leading armies into battle,flaunting foppish fashions,singing pop songs,fighting for democracy
Benjamin Chavez, 20000178, DS, performing household chores,striving for world domination,punishing criminals,analyzing murder scenes,fighting for the resistance,collecting comic books,solving crimes,tricking criminals,finding clues,hunting monsters
Porsha Choate, 20000311, CS, interpreting evidence,running a budget airline,abusing minorities,ordering wire-taps,making lewd remarks,offering gnostic advice,directing action movies,eluding the public gaze,selling out,podcasting about movies
Hsiu Mattos, 20000236, CS, singing protest songs,interviewing politicians,abusing minorities,creating an axis of evil,writing for the New Yorker,running a bureaucracy,writing on wax tablets,spreading philosophy,writing comedy,test-driving cars
Shemika Read, 20000243, DS, finding clues,promoting mysticism,climbing social ladders,solving mysteries,solving crimes,fighting in gladiator arenas,gadding about town,keeping a diary,climbing social ladders,devising evil schemes
Samuel Allen, 20000074, CS, directing comedies,eluding the public gaze,studying science,speaking with funny accents,making lewd remarks,running an empire,promoting Heliocentrism,singing pop songs,racking up marriages,manipulating political pawns
Tracy Jennings, 20000472, CS, starring in Hollywood movies,promoting conservative values,promoting open-source software,singing torch songs,tending the garden,designing clothes,writing for the New Yorker,running a movie studio,knocking out opponents,promoting conservative values
Theo Compton, 20000214, DS, preventing crime,running a frontier town,offering advice,solving crimes,studying magic,hunting demons,attacking consumerism,pushing haute couture,traveling in time,handing out flowers
Joni Velasquez, 20000210, DS, spreading revolution,promoting conservative values,attending cocktail parties,subverting social conventions,fighting the forces of good,solving mysteries,being condescending to customers,singing country music,playing basketball,ruining an empire
Romelia Holden, 20000312, CS, ranting about liberals,starring in comedies,healing the sick,enjoying ball-room dancing,crooning love songs,raising cain,writing comedy,making fantasy movies,stabbing in the back,over-acting
Roberto Baker, 20000168, CS, instigating rebellion,building a search engine,betraying friends,making lewd remarks,fighting for worker's rights,stabbing in the back,explaining evolution,running a business empire,wielding political power,writing pop songs
Melissa Alexander, 20000160, CS, betraying friends,enjoying ball-room dancing,writing pop songs,knocking out opponents,promoting circus attractions,puncturing artistic sensibilities,making witty remarks,writing modern fiction,raging against the machine,making lewd remarks
Samuel Allen, 20000074, CS, promoting pacifism,recruiting dissidents,singing pop songs,running an empire,making witty remarks,singing pop songs,commiting perjury,chain-smoking Gauloises Bleues,fighting for worker's rights,writing pop songs
Yuri Oliva, 20000254, CS, starring in comedies,drawing whimsical cartoons,directing violent movies,promoting communism,issuing threats,driving under the influence,betraying friends,fighting for worker's rights,gyrating hips,smoking Boyard cigarettes
Luigi Mccray, 20000315, CS, ranting about liberals,doing stand-up,running a business empire,selling tickets,avoiding taxes,campaigning for world peace,eluding the public gaze,punishing crime,telling politicians what to do, fighting for democracy
Sidney Marshall, 20000491, CS, promoting open-source software,building houses for poor people,doing slapstick comedy,cross-dressing in women's clothes,winning heavyweight titles,ruling over subjects,campaigning for the presidency,puncturing artistic sensibilities,writing on wax tablets,collecting rock samples
Tonya Dunn, 20000432, CS, speaking with funny accents,raising cain,puncturing artistic sensibilities,promoting communism,selling out,blanketing staff with memos,creating an axis of evil,betraying friends,building houses for poor people,exploring the new world
Nicole Newton, 20000171, CS, wielding political power, fighting with swords,campaigning for the presidency,singing pop songs,running a business empire,campaigning for democracy,punishing crime,writing pop songs,ordering wire-taps,surviving large-scale floods
Lela Garza, 20000466, DS, fighting with swords,bending spoons,talking to mirrors,analyzing murder scenes,hunting demons,teaching philosophy,running for governor,promoting greed,signing sports memorabilia,killing demons
Hee Welker, 20000375, CS, singing pop songs,wielding political power,performing Web searches,leading revolts,running an empire,cooking dinners,writing on wax tablets,leading armies into battle,searching for the messiah,promoting world peace
Charisse Duval, 20000203, CS, starring in sit-coms,performing Web searches,promoting Heliocentrism,starring in Hollywood movies,running a crime family,curing lepers,writing comedy,arresting criminals,ranting about liberals,promoting conservative values
Jeffrey Scott, 20000063, DS, fighting in gladiator arenas,studying science,singing country music,promoting science,drinking demon blood,running a frontier town,singing pop songs,defending the weak,singing Hipbop songs,finding clues
Eufemia Mcduffie, 20000368, CS, singing pop songs,campaigning for democracy,spreading political gossip,promoting air travel,starring in Hollywood movies,chain-smoking Gauloises Bleues,starring in Hollywood movies,promoting feminism,promoting vegetarianism,singing pop songs
Sage Goldsmith, 20000216, CS, healing the sick,running an empire,writing pop songs,raising cain,spreading philosophy,selling cheap airline seats,test-driving cars,doing slapstick comedy,starring in Hollywood movies,selling out
Kattie Fountain, 20000266, CS, running a movie studio,speaking with funny accents,crushing dissent,punishing crime,publishing soft pornography,tending the garden,producing Hipbop records,ranting about liberals,campaigning for social causes,writing scripts
Catherine Hernandez, 20000069, CS, raging against the machine,interviewing celebrities,making lewd remarks,wielding political power,enjoying ball-room dancing,selling cheap airline seats,producing Hipbop records,selling out,building a wooden ark,ranting about liberals
Olga Copeland, 20000163, DS, playing pop music,promoting conservative values,duelling acrobatically,punching out Nazis,finding clues,killing demons,tricking criminals,wielding political power,creating nightmares,killing demons
Romona Mccain, 20000365, DS, clinging to past dreams,selling cosmetics,pushing haute couture,counting calories,unearthing ancient tombs,spying for the enemy,killing teenagers,being condescending to customers,running a clandestine spy organization,interpreting evidence
Francesco Fortune, 20000244, CS, making witty remarks,creating an axis of evil,promoting conservative values,offering gnostic advice,commiting perjury,raging against the machine,dating centrefolds,promoting conservative values, fighting for democracy,selling stock cubes
Garry Rios, 20000423, DS, doing slapstick comedy,reading self-help books,analyzing intelligence data,terrorizing sleepers,keeping accounts,being condescending to customers,killing demons,performing kung-fu moves,promoting capitalism,subverting social conventions
Jesse Cooper, 20000038, DS, writing purple prose,making cartoons,interviewing celebrities,expressing violent urges,womanizing,killing monsters,slashing victims,working with nuclear materials,kicking ass,finding clues
Dave Hammond, 20000490, CS, winning Oscars,drawing whimsical cartoons,arresting criminals,fighting with swords,teaching philosophy,building houses for poor people,doing stand-up,building rocket ships,hiding from the public,ruling over subjects
Karla Reeves, 20000461, CS, wielding political power,investing money,promoting circus attractions,promoting open-source software,foiling the schemes of evil villains ,selling out,singing rock songs,crooning love songs,making political gaffes,making science fiction movies
Chantay Dickinson, 20000230, DS, climbing social ladders,knocking out opponents,making science fiction movies,solving riddles,drinking demon blood,offering advice,solving crimes,hunting demons,promoting capitalism,directing movies
Jamie Brewer, 20000405, CS, writing mystery stories,interviewing celebrities,writing pop songs,fighting for worker's rights,winning boxing matches,punishing crime,making lewd remarks,enjoying ball-room dancing,tending the garden,bugging political rivals
Billy Garcia, 20000003, CS, running an empire,making political gaffes,teaching philosophy to future leaders,writing TV comedies,running a movie studio,promoting conservative values,wielding political power,shilling for rental car companies,writing pop songs,promoting conservative values
Jacquiline Mcmanus, 20000204, CS, drawing whimsical cartoons,promoting world peace,interpreting evidence,developing cunning plans,spreading philosophy,promoting vegetarianism,running a reich,selling tickets,ranting about liberals,seducing women
Karen Bell, 20000157, DS, publishing newspapers,performing magic tricks,solving mysteries,clinging to past dreams,teaching philosophy,solving crimes,promoting logical thinking,amassing wealth,solving crimes,devising evil schemes
Dominica Otero, 20000206, CS, trading innuendo,enjoying ball-room dancing,running an empire,writing scripts,ruling over subjects,making witty remarks,interviewing celebrities,writing rap songs,fighting for worker's rights,wielding political power
Ervin Lee, 20000173, CS, selling comic books,devising evil schemes,recruiting dissidents,starring in sit-coms,selling franchises,playing drums,drawing whimsical cartoons,campaigning for social causes,throwing TVs out of the windows,seducing women
Bridgett Shah, 20000317, DS, running for governor,shopping for shoes,promoting American values,subverting social conventions,teaching philosophy,writing about social problems,tormenting muggles,pursuing criminals,killing demons,promoting conservative values
Romelia Holden, 20000312, CS, running for the presidency,arresting criminals,making unauthorized sex tapes,fighting for democracy,studying science,campaigning for social causes,interviewing celebrities,speaking with funny accents,singing Hipbop songs,developing operating systems
Lester Holt, 20000496, DS, defending the weak,promoting capitalism,analyzing murder scenes,promoting science,punishing criminals,finding clues,cashing checks,being condescending to customers,studying magic tricks,solving crimes
Wilfred Craig, 20000114, CS, writing pop songs,leading armies into battle,starring in sit-coms,hiding from the public,speaking with funny accents,winning tennis tournaments,selling cosmetics, fighting with swords,creating an axis of evil,bugging political rivals
Vicky Blake, 20000102, DS, defending the weak,pursuing criminals,writing purple prose,handing out flowers,preparing for war,selling fast food,solving crimes,hunting demons,promoting science,singing country music
King Holbrook, 20000267, CS, curing lepers,making subversive art,pioneering new technologies,interviewing politicians,singing pop songs,running a media empire,writing plays,running a reich,writing for the New Yorker,making science fiction movies
Albert Mitchell, 20000079, CS, starring in Hollywood movies,healing the sick,investing money,drawing whimsical cartoons,running a crime family,promoting world peace,campaigning for world peace,knocking out opponents,promoting conservative values,promoting communism
Anthony Phan, 20000354, DS, solving crimes,promoting conservative values,solving crimes,playing poker badly,working with nuclear materials,selling confectionary,running a media empire,promoting greed,studying icons,creating nightmares
Virgil Jacobs, 20000500, CS, running a budget airline,healing the sick,winning boxing matches,abusing minorities,betraying friends,running an empire,seducing women,singing pop songs,tending the garden,promoting circus attractions
Caroline Payne, 20000474, CS, ranting about liberals,running a business empire,promoting Catholic values,starring in Hollywood movies,crushing dissent,making antisemitic remarks,commiting perjury,making cartoons,making political gaffes,instigating rebellion
Gabriel Webster, 20000161, DS, devising evil schemes,tracking down criminals,fighting for the resistance,chasing jellyfish,ruining an empire,playing pranks,digging for antiquities,striving for world domination,launching hostile takeovers,foiling the schemes of evil villains
Thelma Burton, 20000494, CS, starring in sit-coms,making political gaffes,wielding political power,teaching philosophy to future leaders,making subversive art,singing torch songs,recruiting dissidents,knocking out opponents,writing comedy,selling comic books
Stacee Barth, 20000324, CS, writing polemics,making political gaffes,living amongst apes,developing operating systems,worrying about health,writing scripts,blanketing staff with memos,interviewing politicians,raging against the machine,lying on the stand
Damon Copeland, 20000476, DS, running a multinational corporation,racking up marriages,performing magic tricks,studying magic tricks,terrorizing sleepers,tracking down criminals,gadding about town,frying crabby patties,fighting for the rebel alliance,promoting mysticism
Tiffany Obrien, 20000452, CS, teaching the next generation,eluding the public gaze,writing TV comedies,arguing with political opponents,promoting communism,singing protest songs,campaigning for social causes,building giant walls,starring in Hollywood movies,teaching philosophy
Lovella Sumner, 20000262, DS, eluding electronic ghosts,manipulating political pawns,chasing murderers,protecting criminals,doing slapstick comedy,extracting confessions,solving crimes,blowing smoke rings,making science fiction movies,pushing shoddy merchandise
Bill Chavez, 20000408, DS, solving crimes,attending cocktail parties,slashing victims,teaching magic,promoting greed,promoting capitalism,keeping a diary,fighting with swords,selling comic books,flying into a rage
Thomas Tyler, 20000413, DS, finding clues,chasing murderers,killing teenagers,teaching magic,promoting mysticism,womanizing,hunting demons,exorcising demons,counting calories,pioneering new technologies
Elbert Carroll, 20000126, DS, solving crimes,running a frontier town,engaging in bare-knuckle fighting,promoting democracy,impersonating women,arresting criminals ,killing teenagers,bending spoons,collecting comic books,finding clues
Lou Koch, 20000207, DS, promoting feminism,blowing smoke rings,extracting confessions,inventing electrical marvels,hunting monsters,making ice sculptures,living amongst apes,planning assassinations,running a media empire,hunting demons
Catherine Hernandez, 20000069, CS, singing torch songs,interviewing politicians,running a multinational corporation,making fantasy movies,writing pop songs,recording pop songs,eluding the public gaze,winning boxing matches, fighting for democracy,selling tickets
Lorinda Dykes, 20000213, CS, starring in comedies,leading revolts,preventing crime,making dumb comedies,recruiting dissidents,promoting conservative values,spreading political gossip,singing torch songs,starring in Hollywood movies,winning tennis tournaments
Larry Henning, 20000339, DS, grabbing power,performing magic tricks,promoting mysticism,talking to mirrors,gadding about town,campaigning for social causes,pursuing criminals,performing magic tricks,avoiding growing old,wielding political power
Ann Mack, 20000123, CS, fighting for democracy,interpreting evidence,singing pop songs,betraying friends,ranting about liberals,writing pop songs,making science fiction movies,cross-dressing in women's clothes,creating an axis of evil,recording pop songs
Diana Baker, 20000004, CS, starring in Hollywood movies,making cartoons,signing sports memorabilia,podcasting about movies,drawing whimsical cartoons,publishing soft pornography,searching for a new world,ruling over subjects,designing clothes,managing hedge funds
Christine Walker, 20000005, CS, explaining evolution,betraying friends,starring in romantic comedies,throwing Bunga Bunga parties,writing pop songs,writing modern fiction,avoiding taxes,campaigning for social causes,running a business empire,doing slapstick comedy
Shawnna Fleck, 20000220, CS, designing clothes,throwing TVs out of the windows,selling tickets,spreading political gossip,shilling for rental car companies,racking up marriages,running an empire,launching cultural revolutions,starring in sit-coms,crushing dissent
Marcus Walton, 20000438, CS, campaigning for democracy,starring in Hollywood movies,promoting world peace,writing polemics,chain-smoking Gauloises Bleues,making antisemitic remarks,insulting minorities,running a business empire,shilling for rental car companies,writing plays
