Melissa Alexander, 20000160, CS, selling cosmetics,tending the garden,developing cunning plans,building a wooden ark,issuing threats,seducing women,singing middle-of-the-road songs,campaigning for the presidency,curing lepers,writing pop songs
Heather Turner, 20000061, DS, making science fiction movies,blowing smoke rings,killing teenagers,playing pranks,promoting greed,solving mysteries,talking to mirrors,building an army,solving crimes,counting money
Penny Grant, 20000425, CS, directing violent movies,running a business empire,chain-smoking Gauloises Bleues,managing large development projects,running a movie studio,running an empire,issuing threats,smoking Boyard cigarettes,making vulgar jokes,racking up marriages
Marian Jennings, 20000120, CS, selling franchises,campaigning for the presidency,producing Hipbop records,ranting about liberals,worrying about health,starring in Hollywood movies,performing household chores,starring in Hollywood movies,running a bureaucracy,singing pop songs
Adrian Rose, 20000103, CS, organizing a putsch,making vulgar jokes,interviewing politicians,womanizing,ruling over subjects,stabbing in the back,selling out,searching for a new world,running an empire,promoting circus attractions
Kenyatta Craft, 20000320, DS, promoting mysticism,foiling the schemes of evil villains,punishing criminals,grabbing power,promoting new wars,promoting capitalism,applying science,terrorizing employees,commanding Roman legions,amassing wealth
Marta Gray, 20000477, CS, ordering wire-taps,racking up marriages,making political gaffes,interviewing celebrities,promoting world peace,selling franchises,developing operating systems,running a bureaucracy,podcasting about movies,fighting for civil rights
Russell Jackson, 20000031, DS, solving riddles,playing pranks,directing movies,promoting conservative values,offering legal advice,devising evil schemes,avoiding growing old,tormenting muggles,climbing social ladders,promoting capitalism
Marva Sheppard, 20000333, CS, writing scripts,directing action movies,raging against the machine,selling comic books,blanketing staff with memos,trading innuendo,campaigning for social causes,winning boxing matches,campaigning for social causes,making unauthorized sex tapes
Catherine Hernandez, 20000069, CS, selling out,investing in real estate,writing hawkish memos,surviving fatwas,enriching uranium,surviving large-scale floods,bugging political rivals,running a business empire,writing modern fiction,running a budget airline
Pennie Melvin, 20000205, DS, reading the news,promoting logical thinking,bending spoons,running a newspaper empire,protecting criminals,punishing criminals,pushing shoddy merchandise,promoting conservative values,killing demons,pushing haute couture
Marlen Poston, 20000387, CS, developing operating systems,reusing readymades,healing the sick,fighting with swords,making cartoons,promoting communism,selling tickets,cooking dinners,promoting conservative values,raging against the machine
Karma Kelleher, 20000272, CS, raging against the machine,shilling for rental car companies,over-acting,promoting Scientology,teaching philosophy,throwing TVs out of the windows,promoting open-source software,foiling the schemes of evil villains ,ruling over subjects,writing plays
Beverlee Whited, 20000260, DS, killing monsters,finding clues,solving crimes,solving crimes,pinching pennies,making soap,protecting criminals,interpreting evidence,clinging to past dreams,solving crimes
Christine Walker, 20000005, DS, spouting movie trivia,solving mysteries,promoting feminism,performing magic tricks,pushing shoddy merchandise,writing about social problems,making cartoons,pinching pennies,developing new technologies,pushing haute couture
Kevin Richardson, 20000092, DS, devising evil schemes,promoting logical thinking,expressing violent urges,chasing murderers,killing demons,subverting social conventions,piloting a spaceship,campaigning for democracy,teaching magic,promoting mysticism
Earlean Capps, 20000389, DS, playing rock music,drawing whimsical cartoons,pioneering new technologies,pioneering new technologies,tormenting muggles,finding clues,drinking Duff beer,smoking herb,writing about social problems,promoting science
Valentine Villegas, 20000351, CS, promoting open-source software,test-driving cars,promoting conservative values,starring in Hollywood movies,campaigning for social causes,stabbing in the back,interviewing politicians,running a business empire,promoting pacifism,singing torch songs
Ann Mack, 20000123, CS, ranting about liberals,ordering wire-taps,running for the presidency,starring in Hollywood movies,starring in Hollywood movies,podcasting about movies,over-acting,hiding from the public,creating an axis of evil,lying on the stand
Larry Rose, 20000407, CS, promoting circus attractions,crooning love songs,making fantasy movies,leading armies into battle,making lewd remarks,winning heavyweight titles,recording pop songs,developing operating systems,ruling over subjects,spreading philosophy
Christine Walker, 20000005, DS, singing country music,studying icons,finding clues,making money,killing demons,maintaining salon-quality hair,devising evil schemes,making science fiction movies,promoting science,driving under the influence
Karla Lowe, 20000150, DS, trimming bushes,killing teenagers,bending spoons,running a frontier town,smoking Laramie Hi-Tars,inventing new confectionary,hunting demons,playing pop music,doing slapstick comedy,making science fiction movies
Stephane Pickard, 20000225, DS, performing magic tricks,avoiding growing old,handing out flowers,hacking into corporate mainframes,playing soccer,devising evil schemes,smoking cigars,fighting with swords,publishing newspapers,running a frontier town
Diane Rodriguez, 20000068, DS, creating nightmares,slashing victims,collecting green Kryponite,solving riddles,subverting social conventions,making lewd remarks,handing out flowers,devising evil schemes,killing teenagers,pursuing criminals
Kennith Pauley, 20000398, CS, insulting minorities,winning heavyweight titles,building a search engine,campaigning for world peace,dating centrefolds,singing pop songs,promoting movie violence,interpreting evidence, fighting for democracy,making dumb comedies
Troy Jensen, 20000143, CS, recruiting dissidents,making cartoons,promoting world peace,instigating rebellion,writing scripts,starring in comedies,promoting pacifism,solving crimes,selling comic books,leading revolts
Guillermo Hawkins, 20000433, CS, singing pop songs,publishing soft pornography,designing clothes,selling out,punishing crime,interviewing politicians,running a reich,recording pop songs, fighting for democracy,womanizing
Joyce Welch, 20000401, CS, preaching tolerance,wielding political power,knocking out opponents,blanketing staff with memos,running a crime family,test-driving cars,running a crime family,surviving large-scale floods,singing pop songs,promoting vegetarianism
Lee Klein, 20000104, CS, starring in Hollywood movies,making cartoons,writing plays,promoting movie violence,shilling for rental car companies,running a frontier town,ruining an empire,promoting world peace,singing pop songs,developing open-source software
Lester Holt, 20000496, CS, selling franchises,fighting with swords,dating centrefolds,performing household chores,getting plastic surgery,promoting conservative values,selling cheap airline seats,singing Hipbop songs,running a reich,starring in Hollywood movies
Chris Carter, 20000498, DS, selling fast food,spouting movie trivia,running a business empire,instigating rebellion,performing magic tricks,hunting demons,grabbing power,chasing jellyfish,promoting capitalism,pioneering new technologies
Isis Oglesby, 20000237, CS, making political gaffes,doing slapstick comedy,writing pop songs,drawing whimsical cartoons,running a bureaucracy,promoting democracy,drawing whimsical cartoons,knocking out opponents,searching for a new world,campaigning for world peace
Rose Thompson, 20000050, CS, running a kingdom, fighting with swords,starring in comedies,offering gnostic advice,crushing dissent,searching for a new world,interpreting evidence,enjoying ball-room dancing,changing sides,punishing crime
Ross Aguilar, 20000148, CS, starring in romantic comedies,teaching philosophy,selling franchises,winning heavyweight titles,punishing crime,playing the clarinet,running a movie studio,trading innuendo,promoting liberalism,whining at umpires
Yelena Ratliff, 20000282, CS, starring in musical comedies,playing drums,singing torch songs,making witty remarks,selling tickets,jumping on couches,leaking information,making science fiction movies,developing cunning plans,making violent movies
Ricky Parker, 20000127, DS, rooting out moles,chasing jellyfish,playing rock guitar,turning it up to 11,killing demons,flying into a rage,counting calories,hacking into corporate mainframes,doing slapstick comedy,promoting new wars
Rebecca Dennis, 20000440, CS, launching cultural revolutions,directing action movies,running a frontier town,arresting criminals,chain-smoking Gauloises Bleues,spreading philosophy,performing household chores,bugging political rivals,making unauthorized sex tapes,launching cultural revolutions
Adina Lim, 20000361, DS, studying science,performing magic tricks,punishing criminals,tormenting muggles,campaigning for democracy,teaching magic,preventing crime,clipping coupons,maintaining salon-quality hair,interpreting evidence
Shirley Morris, 20000028, CS, issuing threats,writing comedy,losing weight,writing pop songs,starring in comedies,blanketing staff with memos,interviewing politicians,winning boxing matches,running a fast-food business,running a bureaucracy
Joni Velasquez, 20000210, DS, finding clues,promoting capitalism,turning it up to 11,campaigning for democracy,reading self-help books,running for governor,studying magic,devising evil schemes,analyzing the sub-conscious,terrorizing sleepers
Romelia Holden, 20000312, DS, commanding Roman legions,directing movies,publishing newspapers,writing about social problems,flying into a rage,killing people in ingenious ways,studying science,playing soccer,offering legal advice,making cartoons
Caroline Payne, 20000474, DS, playing quidditch,devising evil schemes,foiling the schemes of evil villains,killing demons,tricking criminals,promoting democracy,singing country music,punching out Nazis,eluding capture,expressing violent urges
Louis Torres, 20000097, DS, working with nuclear materials,slashing victims,saving money,introducing cartoons,making topiary sculptures,solving mysteries,wielding political power,creating nightmares,creating nightmares,smoking cigars
Corina Dorman, 20000252, CS, running an empire,ranting about liberals,enjoying ball-room dancing,wielding political power,making unauthorized sex tapes,cooking dinners,investing money,holding evasive press conferences,offering gnostic advice,interpreting evidence
Liana Stinnett, 20000235, CS, running restaurants,speaking with funny accents,knocking out opponents,selling out,making dumb comedies,running a kingdom,promoting conservative values,promoting pacifism,betraying friends,running a crime family
Cristie Romo, 20000248, CS, arresting criminals,writing modern fiction,gyrating hips,seducing women,campaigning for social causes,starring in comedies,avoiding taxes,studying science,developing open-source software,promoting circus attractions
Evangeline Benitez, 20000276, DS, selling fast food,climbing social ladders,promoting logical thinking,solving crimes,finding clues,gadding about town,eating census takers,spreading revolution,seducing women,playing pop music
Jose Washington, 20000037, DS, clipping coupons,expressing violent urges,rescuing damsels in distress,maintaining a secret identity,plotting election strategies,inventing time machines,writing about social problems,eluding capture,directing movies,publishing newspapers
Joanne Vaughn, 20000122, CS, starring in Hollywood movies,singing torch songs,studying science,starring in musical comedies,writing plays,promoting Heliocentrism,promoting Scientology,writing pop songs,searching for the messiah,promoting conservative values
Mark Stewart, 20000081, DS, protecting criminals,running a business empire,clinging to past dreams,gossiping with galpals,womanizing,killing teenagers,promoting the Dark Side,working with nuclear materials,piloting a spaceship,drinking too much red wine
Evangeline Benitez, 20000276, DS, playing soccer,creating nightmares,terrorizing sleepers,spreading revolution,maintaining salon-quality hair,brewing magican potions,making science fiction movies,finding clues,tricking criminals,solving crimes
Judith Butler, 20000146, CS, knocking out opponents,issuing threats,making fantasy movies,writing serialized stories,smoking Boyard cigarettes,promoting communism,chain-smoking Gauloises Bleues,promoting Scientology,writing pop songs,selling out
Kasie Berube, 20000227, DS, interpreting evidence,teaching magic,pioneering new technologies,hunting demons,chasing jellyfish,creating nightmares,killing teenagers,extracting confessions,spouting movie trivia,signing sports memorabilia
Pete Reed, 20000188, CS, singing pop songs,starring in Hollywood movies,writing modern fiction,smoking Boyard cigarettes,building a search engine,running a kingdom,creating an axis of evil,surviving fatwas,singing country music,starring in comedies
Candace Maldonado, 20000414, CS, writing modern fiction,shilling for rental car companies,arresting criminals,making unauthorized sex tapes,launching cultural revolutions,launching cultural revolutions,making dunk shots,building a search engine,building houses for poor people,recruiting dissidents
Percy Walker, 20000465, DS, pushing shoddy merchandise,acting off-off-Broadway,womanizing,teaching philosophy,clinging to past dreams,chasing jellyfish,playing pop music,slashing victims,subverting social conventions,pioneering new technologies
Ann Mack, 20000123, CS, raging against the machine,commiting perjury,interviewing politicians,running a reich,campaigning for the presidency,directing comedies,cooking dinners,drawing whimsical cartoons,developing operating systems,making unauthorized sex tapes
Theresa Pratt, 20000416, CS, hiding from the public,promoting conservative values,promoting conservative values,making unauthorized sex tapes,writing comedy,teaching philosophy,podcasting about movies,winning heavyweight titles,starring in indy movies,running a crime family
Saundra Mchenry, 20000285, CS, wielding political power,campaigning for world peace,singing middle-of-the-road songs,interpreting evidence,running for the presidency,abusing minorities,campaigning for democracy,starring in Hollywood movies,promoting vegetarianism,driving under the influence
Sharilyn Tyson, 20000341, CS, winning boxing matches,promoting liberalism,managing hedge funds,abusing minorities,living amongst apes,betraying friends,ranting about liberals,fighting for democracy,selling tickets,performing household chores
Leigh Morris, 20000191, CS, promoting pacifism,teaching the next generation,writing serialized stories,running an empire,ranting about liberals,directing action movies,ranting about liberals,winning heavyweight titles,campaigning for the presidency,singing pop songs
Antonio Santana, 20000346, CS, knocking out opponents,promoting conservative values,singing middle-of-the-road songs,writing scripts,crooning love songs,blanketing staff with memos,doing slapstick comedy,singing rock songs,enjoying ball-room dancing,opening a new front
Masako Moreau, 20000395, DS, playing rock guitar,analyzing murder scenes,solving crimes,spreading revolution,bending spoons,running a fast-food business,solving crimes,protecting criminals,foiling the schemes of evil villains,studying magic tricks
Sarah Curtis, 20000468, CS, building houses for poor people,cooking dinners,searching for the messiah,doing slapstick comedy,starring in Hollywood movies,doing stand-up,singing rock songs,singing pop songs,running a business empire,singing pop songs
Frances Sanders, 20000053, DS, turning it up to 11,casting magic spells,reading self-help books,keeping a diary,losing control,piloting a spaceship,extracting confessions,writing purple prose,knocking out opponents,smuggling contraband
Elroy Miner, 20000253, DS, terrorizing sleepers,directing movies,finding clues,singing country music,writing purple prose,spreading revolution,delivering forehand slams,piloting a spaceship,expressing violent urges,promoting logical thinking
Russell Jackson, 20000031, CS, playing the clarinet,running a business empire,starring in Hollywood movies,betraying friends,making lewd remarks,foiling the schemes of evil villains ,launching cultural revolutions,doing slapstick comedy,offering gnostic advice,making movies
Elbert Carroll, 20000126, DS, inventing electrical marvels,arresting criminals ,studying mathematics,pushing shoddy merchandise,publishing newspapers,running a business empire,making money,killing people in ingenious ways,commanding Roman legions,creating nightmares
Deborah Adkins, 20000463, CS, campaigning for the presidency,enjoying ball-room dancing,chasing after women,teaching the next generation,promoting conservative values,running a crime family,smoking Boyard cigarettes,singing pop songs,promoting movie violence,gyrating hips
Brittaney Le, 20000301, CS, running a kingdom,wielding political power,ranting about liberals,promoting communism,winning Oscars,promoting conservative values,running a budget airline,starring in Hollywood movies,preventing crime,scandalizing polite society
Candice Jimenez, 20000115, DS, performing magic tricks,pushing haute couture,dreaming of yesteryear,doing slapstick comedy,frying peanut-butter and banana sandwiches,hunting demons,singing Hipbop songs,studying magic tricks,turning it up to 11,creating nightmares
Casey Chambers, 20000117, CS, arguing with political opponents,blanketing staff with memos,promoting liberalism,tending the garden,ruling over subjects,collecting treasures,publishing soft pornography,eluding the public gaze,arresting criminals,driving under the influence
Janine Albert, 20000340, CS, starring in Hollywood movies,bugging political rivals,running a fast-food business,launching cultural revolutions,campaigning for social causes,building a search engine,campaigning for social causes,making mediocre movies,commiting perjury,campaigning for social causes
Janice Lewis, 20000014, CS, promoting political causes,explaining evolution,winning heavyweight titles,healing the sick,singing pop songs,promoting racial harmony,making science fiction movies,interpreting evidence,playing drums,campaigning for social causes
Alesha Headley, 20000397, CS, writing rock songs,preventing crime,ruining an empire,manipulating political pawns,shilling for rental car companies,speaking with funny accents,punishing crime,making political gaffes,starring in indy movies,writing polemics
Love Shores, 20000377, DS, finding clues,performing household chores,performing magic tricks,attacking consumerism,solving crimes,drinking Duff beer,running a fast-food business,blowing smoke rings,studying science,handing out flowers
Jack Brown, 20000023, CS, starring in Hollywood movies,writing comedy,making fantasy movies,promoting democracy,teaching philosophy to future leaders,making unauthorized sex tapes,raising cain,spreading philosophy,promoting conservative values,ranting about liberals
Claude Curry, 20000200, CS, winning Oscars,launching cultural revolutions,creating an axis of evil,wielding political power,starring in Hollywood movies,publishing soft pornography,curing lepers,making violent movies,making political gaffes,avoiding taxes
Adrian Rose, 20000103, CS, blanketing staff with memos,making political gaffes,designing clothes,abusing minorities,selling out,writing short stories,promoting conservative values,running races,leading revolts,smoking Boyard cigarettes
Rose Thompson, 20000050, DS, solving crimes,promoting democracy,analyzing murder scenes,traveling in time,killing rival gladiators,killing demons,performing magic tricks,defending the weak,handing out flowers,amassing wealth
Tracy Holmes, 20000136, DS, pioneering new technologies,piloting a spaceship,promoting conservative values,eating donuts,slashing victims,studying magic,extracting confessions,solving crimes,being condescending to customers,knocking out opponents
Samuel Fields, 20000158, DS, eating donuts,working for the forces of darkness,promoting capitalism,analyzing murder scenes,promoting new wars,commanding Roman legions,performing household chores,analyzing the sub-conscious,digging for antiquities,womanizing
Brett Haynes, 20000176, DS, analyzing intelligence data,running a clandestine spy organization,doing slapstick comedy,subverting social conventions,playing rock guitar,attacking consumerism,fighting barbarian hordes,smuggling contraband,releasing the hounds,studying science
Carletta Gilliland, 20000218, CS, directing animated films,promoting conservative values,teaching philosophy to future leaders,starring in indy movies,performing household chores,running restaurants,leading armies into battle,wielding political power,writing pop songs,singing torch songs
Laquanda Wynn, 20000310, CS, running restaurants,teaching philosophy,promoting Heliocentrism,making fantasy movies,cross-dressing in women's clothes, fighting for democracy,giving investment advice,singing protest songs,betraying friends,promoting communism
Jeannette Owen, 20000489, DS, digging for antiquities,punishing criminals,foiling the schemes of evil villains,plotting election strategies,cashing checks,climbing social ladders,promoting science,playing rock guitar,studying icons,creating annoying rules
Hee Welker, 20000375, CS, singing Hipbop songs,campaigning for the presidency,foiling the schemes of evil villains ,running for the presidency,wielding political power,campaigning for world peace,developing open-source software,writing comedy,starring in Hollywood movies,test-driving cars
Flora Pittman, 20000486, DS, studying magic tricks,maintaining salon-quality hair,handing out flowers,writing purple prose,killing demons,flying into a rage,solving crimes,extracting confessions,tormenting muggles,studying science
Dan Pope, 20000174, CS, promoting movie violence,abusing minorities,making witty remarks,tending the garden,singing middle-of-the-road songs,giving investment advice,crushing dissent,running a movie studio,spreading philosophy,shilling for rental car companies
Craig Kelly, 20000164, CS, selling cheap airline seats,promoting open-source software,speaking with funny accents,smoking Boyard cigarettes,writing polemics,hiding from the public,selling comic books,creating an axis of evil,cross-dressing in women's clothes,starring in Hollywood movies
Justin Crawford, 20000156, CS, wielding political power,healing the sick,campaigning for social causes,starring in sit-coms,betraying friends,commiting perjury,running a kingdom,starring in Hollywood movies,running a crime family,developing open-source software
Rosaline Flagg, 20000318, CS, promoting world peace,recruiting dissidents,test-driving cars,instigating rebellion,selling cheap airline seats,running a business empire,hiding from the public,flaunting foppish fashions,running an empire,playing the clarinet
Nicole Johnson, 20000096, CS, writing serialized stories,singing Hipbop songs,worrying about health,recording pop songs,starring in sit-coms,crushing dissent,searching for a new world,campaigning for social causes,campaigning for world peace,creating an axis of evil
Judith Butler, 20000146, CS, living amongst apes,healing the sick,staring at the moon,campaigning for the presidency,teaching the next generation,promoting political causes,spreading political gossip,flaunting foppish fashions,singing pop songs,singing torch songs
Johanna Jordan, 20000192, DS, climbing social ladders,studying magic,tricking criminals,grabbing power,promoting logical thinking,eating donuts,cross-dressing in women's clothes,piloting a spaceship,drinking too much red wine,counting calories
Deborah Adkins, 20000463, DS, playing quidditch,cheating at poker,running a media empire,plotting election strategies,promoting feminism,running a business empire,teaching philosophy,playing rock guitar,extracting confessions,grabbing power
Indira Savage, 20000287, DS, performing magic tricks,killing demons,trimming bushes,offering legal advice,playing pop music,killing people in ingenious ways,solving crimes,publishing newspapers,foiling the schemes of evil villains,punching out Nazis
Earlean Capps, 20000389, DS, eluding capture,hunting demons,making topiary sculptures,pioneering new technologies,publishing newspapers,solving mysteries,writing about social problems,wielding political power,piloting a spaceship,playing rock guitar
Cecilia Farmer, 20000459, DS, counting money,brewing magican potions,engaging in bare-knuckle fighting,hunting monsters,promoting mysticism,performing magic tricks,fighting with swords,directing movies,impersonating women,teaching magic
Lakia Bair, 20000347, CS, running a budget airline,healing the sick,publishing soft pornography,promoting liberalism,speaking with funny accents,starring in sit-coms,running a kingdom,writing polemics,campaigning for social causes,solving crimes
Valentine Villegas, 20000351, CS, fighting for worker's rights,promoting conservative values,winning tennis tournaments,raging against the machine,singing pop songs,starring in romantic comedies,spreading philosophy,leading revolts,worrying about health,performing household chores
Jade Arthur, 20000215, CS, opening a new front,performing household chores,changing sides,running a kingdom,writing pop songs,promoting vegetarianism,knocking out opponents,seducing women,singing pop songs,making witty remarks
