Kimberli Whatley, 20000396, CS, writing pop songs,test-driving cars,promoting charity,writing rap songs,singing pop songs,promoting new technologies,making witty remarks,developing new technologies ,promoting conservative values,developing cunning plans
Jamie Brewer, 20000405, CS, ranting about liberals,making dunk shots,seducing miltary officers,raising cain,writing modern fiction,ruling over subjects,singing country music,singing pop songs,developing new technologies ,enriching uranium
Yael Stubblefield, 20000299, DS, tricking criminals,starring in Hollywood movies,cross-dressing in women's clothes,making soap,working for the forces of darkness,interpreting evidence,tempting fate,leading revolts,looking for hidden treasures,treating diseases
Casey Chambers, 20000117, DS, interpreting evidence,spying for the enemy,spreading revolution,shopping for shoes,building a search engine,unearthing ancient tombs,tricking criminals,eating power pellets,selling out,fighting the forces of good
Joanne Vaughn, 20000122, CS, struggling with modern times,tolerating adultery,leaking state secrets,singing pop songs,running assembly lines,running for the senate,writing pop songs,piquing public interest,selling military secrets,developing cunning plans
Starr Dickerson, 20000322, CS, engaging in hapless hijinks,arguing against capitalism,singing country music,running for the senate,attacking neighbors,making witty remarks,making dunk shots,promoting world peace,promoting conservative values,writing rock songs
Adina Lim, 20000361, CS, hacking into computers,promoting charity,writing rock songs,blanketing staff with memos,playing golf,singing country music,promoting pacifism,writing romantic poetry,tolerating adultery,making kitsch
Romelia Holden, 20000312, CS, writing pop songs,campaigning for world peace,opening new markets,playing golf,playing drums,making dunk shots,ruining an empire,singing rock songs,singing pop songs,promoting world peace
Edris Pederson, 20000273, CS, promoting world peace,promoting conservative values,running for the senate,throwing TVs out of the windows,playing drums,leaking state secrets,making witty remarks,making billions,tending the garden,arguing against capitalism
Vicky Blake, 20000102, CS, stabbing in the back,performing Web searches,singing country music,seducing miltary officers,making kitsch,producing Hipbop records,promoting communism,running a tech giant,writing rock songs,ordering wire-taps
Jim Bailey, 20000172, DS, tracking down criminals,attacking consumerism,promoting science,spying for the enemy,smoking cigarettes,digging for antiquities,pioneering new technologies,seducing women,gossiping with galpals,studying science
Darryl Hanson, 20000112, CS, making witty remarks,piquing public interest,ranting about liberals,twirling a cane,spreading revolution,seducing women,opening new markets,writing modern fiction,starring in Hollywood movies,preaching tolerance
Tracy Jennings, 20000472, CS, starring in sit-coms,knocking out opponents,piquing public interest,playing drums,launching cultural revolutions,running for the senate,decrying secrecy,wielding political power,promoting conservative values,ruling over subjects
Mamie Brown, 20000429, DS, drinking too much red wine,bursting out of shirts,preventing crime,leading revolts,preparing for war,spreading revolution,causing mayhem,scandalizing polite society,running a fast-food business,digging for antiquities
Deborah Murphy, 20000046, DS, developing military strategies,selling out,milking coconuts,plotting with the enemy,drinking too much red wine,singing jazz songs,treating diseases,studying magic tricks,enriching uranium,smoking cigarettes
Kelly Johnston, 20000456, CS, arguing against capitalism,ranting about liberals,promoting new technologies,singing rock songs,writing pop songs,singing pop songs,promoting circus attractions,promoting charity,seducing miltary officers,making modern art
Joan Taylor, 20000083, DS, keeping a diary,solving mysteries,tricking criminals,gadding about town,promoting science,seducing women,losing control,engaging in bare-knuckle fighting,subverting social conventions,smoking cigarettes
Elroy Miner, 20000253, DS, appreciating vintage collectibles,teaching magic,punishing criminals,interviewing celebrities,building a search engine,playing rock guitar,collecting Captain America trading cards,preventing crime,selling out,attacking consumerism
Gricelda Eng, 20000386, DS, singing country music,studying symbols,clipping coupons,maintaining a secret identity,playing drums,engaging in bare-knuckle fighting,starring in Hollywood movies,promoting conservative values,studying science,devising evil schemes
Sage Goldsmith, 20000216, CS, promoting racial harmony,promoting charity,playing golf,test-driving cars,spreading philosophy,leaking state secrets,singing pop songs,hosting automotive shows,playing drums,making kitsch
Steve Spencer, 20000180, CS, spreading revolution,funding a cure for malaria,struggling with modern times,promoting conservative values,preaching to presidents,ranting about liberals,exploring foreign countries,running a kingdom,making political gaffes,selling military secrets
Glennie Carnes, 20000367, CS, tolerating adultery,coining sparkling witticisms,writing pop songs,ruling over subjects,wielding political power,singing torch songs,knocking out opponents,singing pop songs,making modern art,promoting communism
Doretha Quezada, 20000384, DS, drinking too much red wine,studying science,duelling acrobatically,bending the law,cross-dressing in women's clothes,finding clues,instigating rebellion,starring in Hollywood movies,preventing crime,suppressing minorities
Rory Esquivel, 20000314, DS, playing drums,pioneering new technologies,running a software company,inventing electrical marvels,chasing electronic ghosts,solving crimes,building a search engine,suppressing minorities,spying for the enemy,pursuing criminals
Susie Frazier, 20000106, CS, writing modern fiction,shilling for rental car companies,making witty remarks,writing pop songs,singing pop songs,tending the garden,campaigning for world peace,twirling a cane,leaking state secrets,winning boxing matches
Margie Fitzgerald, 20000473, CS, blanketing staff with memos,losing weight,starring in sit-coms,opening new markets,starring in Hollywood movies,making billions,shilling for rental car companies,singing country music,producing Hipbop records,engaging in hapless hijinks
Glennie Carnes, 20000367, CS, suppressing minorities,writing for the New Yorker,ranting about liberals,amassing wealth,running a business empire,attacking neighbors,wielding political power,leaking classified documents,holding evasive press conferences,starring in indy movies
Gerald Collins, 20000093, DS, spreading revolution,spying for the enemy,fighting the forces of good,making soap,developing military strategies,studying symbols,pursuing criminals,tricking criminals,interpreting evidence,clipping coupons
Preston Rogers, 20000175, CS, ruining an empire,ruling over subjects,ordering wire-taps,engaging in hapless hijinks,chasing after women,making billions,spreading philosophy,developing new technologies ,enriching uranium,spreading revolution
Preston Rogers, 20000175, DS, punishing criminals,selling out,starring in daytime soap operas,foiling the schemes of evil villains,hunting monsters,singing jazz songs,enriching uranium,preventing crime,attacking consumerism,playing basketball
Jim Bailey, 20000172, CS, campaigning for the presidency,running for the presidency,performing Web searches,singing pop songs,promoting conservative values,decrying secrecy,arguing against capitalism,healing the sick,losing weight,making kitsch
Lois Coleman, 20000090, DS, seeking revenge,making soap,cross-dressing in women's clothes,piquing public interest,studying magic tricks,looking for hidden treasures,pioneering new technologies,running a clandestine spy organization,pushing dodgy operating systems,spreading revolution
Gloria Vargas, 20000495, CS, writing rap songs,winning boxing matches,amassing wealth,twirling a cane,promoting communism,ruining an empire,promoting charity,writing pop songs,making political gaffes,developing new technologies 
Helen Young, 20000020, CS, tolerating adultery,running a tech giant,knocking out opponents,struggling with modern times,exploring foreign countries,wielding political power,enriching uranium,seducing women,singing pop songs,writing pop songs
Yuri Oliva, 20000254, CS, losing weight,enriching uranium,running assembly lines,spreading revolution,instigating rebellion,chasing after women,hacking into computers,singing pop songs,running a kingdom,arguing against capitalism
Solomon Mccallum, 20000357, CS, knocking out opponents,running the FBI,singing rock songs,decrying secrecy,winning heavyweight titles,leading armies into battle,starring in Hollywood movies,singing pop songs,writing rock songs,instigating rebellion
Dennis Edwards, 20000029, DS, brewing magican potions,seeking revenge,attacking consumerism,looking for hidden treasures,bending the law,subverting social conventions,cooking for friends,studying science,following clues,smoking Laramie Hi-Tars
Carole Gomez, 20000460, DS, building a search engine,solving crimes,bursting out of shirts,writing rap songs,interpreting evidence,inventing electrical marvels,unearthing ancient tombs,looking for love,scandalizing polite society,playing Baccarat 
Adriene Orlando, 20000330, DS, interviewing celebrities,seducing women,developing military strategies,bending the law,tricking criminals,piquing public interest,attacking consumerism,promoting science,tracking down criminals,hunting demons
Patsy Mckenzie, 20000162, CS, amassing weapons,playing pop music,starring in Hollywood movies,starring in sit-coms,spreading philosophy,exploring foreign countries,writing pop songs,promoting world peace,writing rap songs,tending the garden
Samantha Ellis, 20000475, CS, ruining an empire,tolerating adultery,writing romantic poetry,ruling over subjects,running assembly lines,promoting charity,decrying secrecy,knocking out opponents,hacking into computers,making modern art
Shelley Brewer, 20000113, DS, promoting the Dark Side,duelling acrobatically,fighting in gladiator arenas,brewing magican potions,tracking down criminals,preventing crime,gossiping with galpals,drinking too much red wine,collecting Captain America trading cards,looking for hidden treasures
Myron Valdez, 20000153, CS, selling military secrets,writing short stories,making witty remarks,starring in madcap comedies,promoting conservative values,seducing women,wielding political power,campaigning for world peace,singing pop songs,tolerating adultery
Yuri Oliva, 20000254, CS, winning heavyweight titles,spreading revolution,running for the senate,campaigning for the presidency,amassing wealth,test-driving cars,coining sparkling witticisms,winning battles,frowning at errant husbands,singing pop songs
Shawnna Fleck, 20000220, CS, developing cunning plans,struggling with modern times,promoting humanism,singing pop songs,opening new markets,writing pop songs,ranting about liberals,promoting new technologies,singing rock songs,hacking into computers
Samantha Ellis, 20000475, CS, ruining an empire,decrying secrecy,shilling for rental car companies,playing drums,playing golf,running assembly lines,spreading revolution,ordering wire-taps,singing pop songs,knocking out opponents
Gricelda Eng, 20000386, DS, subverting social conventions,performing magic tricks,playing basketball,appreciating vintage collectibles,gossiping with galpals,unearthing ancient tombs,tracking down criminals,twirling a cane,studying magic tricks,writing rap songs
Virginia Glover, 20000140, CS, winning battles,writing short stories,enriching uranium,singing pop songs,womanizing,making billions,tolerating adultery,knocking out opponents,developing new technologies ,tending the garden
Sanda Luther, 20000370, CS, decrying secrecy,singing pop songs,writing modern fiction,running assembly lines,tolerating adultery,promoting humanism,developing new technologies ,leading armies into battle,making threatening phone calls,currying favour
Jeremiah Williamson, 20000133, CS, singing pop songs,funding a cure for malaria,making modern art,leading armies into battle,running assembly lines,promoting Kaballah,stabbing in the back,spying for the enemy,currying favour,promoting conservative values
Glennie Carnes, 20000367, CS, scandalizing polite society,promoting world peace,singing pop songs,promoting new technologies,spreading Christianity,piquing public interest,playing drums,struggling with modern times,exploring foreign countries,womanizing
Thelma Burton, 20000494, DS, looking for hidden treasures,developing military strategies,playing basketball,tricking criminals,eating power pellets,running a hardware company,interpreting evidence,keeping a diary,studying symbols,hunting demons
Joline Hinds, 20000250, CS, playing drums,singing rock songs,preaching tolerance,performing moon walks,womanizing,hosting automotive shows,running a kingdom,making political gaffes,chasing after women,shilling for rental car companies
Kimberli Whatley, 20000396, DS, tracking down criminals,running a hardware company,cross-dressing in women's clothes,terrorizing employees,playing drums,eating power pellets,tricking criminals,spreading revolution,brewing magican potions,starring in Hollywood movies
Margarita Foster, 20000128, CS, starring in Hollywood movies,singing pop songs,running assembly lines,exploring foreign countries,test-driving cars,campaigning for the presidency,enriching uranium,funding a cure for malaria,engaging in hapless hijinks,blanketing staff with memos
Phil Stokes, 20000152, DS, promoting wickedness,twirling a cane,maintaining a secret identity,looking for love,tracking down criminals,practicing good skin care,starring in Hollywood movies,fighting in gladiator arenas,preparing for war,looking for hidden treasures
Karma Kelleher, 20000272, DS, preventing crime,tossing coins,making movies,studying science,promoting science,piquing public interest,interviewing celebrities,bending the law,starring in Hollywood movies,commanding Roman legions
Ignacia Foreman, 20000256, DS, tempting fate,studying science,chasing electronic ghosts,smoking Laramie Hi-Tars,studying magic tricks,keeping a diary,killing monsters,pursuing criminals,tracking down criminals,building a search engine
Justin White, 20000058, CS, singing pop songs,writing for the New Yorker,hacking into computers,writing short stories,frowning at errant husbands,womanizing,writing rap songs,leading armies into battle,funding a cure for malaria,making kitsch
Towanda Sales, 20000297, DS, tending the garden,selling out,duelling acrobatically,fighting the forces of good,maintaining a secret identity,playing rock guitar,scandalizing polite society,practicing good skin care,promoting science,looking for hidden treasures
Louis Torres, 20000097, DS, starring in daytime soap operas,interviewing celebrities,cross-dressing in women's clothes,bursting out of shirts,drinking too much red wine,fighting the forces of good,preventing crime,piquing public interest,looking for hidden treasures,offering legal advice
Kirby Landis, 20000228, DS, milking coconuts,solving mysteries,bursting out of shirts,solving crimes,appreciating vintage collectibles,developing new technologies ,developing military strategies,promoting the Dark Side,drinking too much red wine,tricking criminals
Liana Stinnett, 20000235, DS, drinking too much red wine,starring in Hollywood movies,smoking cigarettes,writing rap songs,smoking Laramie Hi-Tars,seeking revenge,casting magic spells,playing drums,making documentaries,hunting demons
Sidney Marshall, 20000491, CS, campaigning for world peace,running for the senate,opening new markets,starring in indy movies,writing pop songs,singing pop songs,promoting circus attractions,writing rock songs,seducing miltary officers,knocking out opponents
Rachel Nelson, 20000087, CS, writing pop songs,singing pop songs,attacking neighbors,decrying secrecy,promoting charity,ranting about liberals,promoting Kaballah,struggling with modern times,making political gaffes,leaking classified documents
Guillermo Hawkins, 20000433, CS, promoting new technologies,winning boxing matches,writing romantic poetry,singing pop songs,playing basketball,promoting circus attractions,enriching uranium,starring in Hollywood movies,seducing miltary officers,playing drums
Marcellus Upton, 20000264, CS, suppressing minorities,blanketing staff with memos,womanizing,engaging in hapless hijinks,singing rock songs,wielding political power,selling kitsch,tolerating adultery,writing pop songs,promoting world peace
Ignacia Foreman, 20000256, CS, cross-dressing in women's clothes,raising cain,piquing public interest,spreading revolution,running assembly lines,promoting charity,twirling a cane,promoting new technologies,amassing wealth,tending the garden
Enrique Johnson, 20000493, DS, gossiping with galpals,treating diseases,developing military strategies,enriching uranium,foiling the schemes of evil villains,punching out Nazis,knocking out opponents,solving crimes,finding clues,clipping coupons
Roselyn Schott, 20000331, CS, singing country music,stabbing in the back,selling tickets,collecting treasures,playing pop music,throwing TVs out of the windows,starring in sit-coms,currying favour,losing weight,developing cunning plans
Kathryn Ramirez, 20000041, DS, developing military strategies,making documentaries,scandalizing polite society,tricking criminals,enriching uranium,brewing magican potions,solving crimes,bursting out of shirts,promoting science,pursuing criminals
Jody Lawrence, 20000419, DS, pursuing criminals,duelling acrobatically,running a hardware company,burning the wicked,preparing for war,seeking revenge,brewing magican potions,pushing dodgy operating systems,developing military strategies,looking for hidden treasures
Marita Blue, 20000246, CS, starring in Hollywood movies,shilling for rental car companies,launching cultural revolutions,opening new markets,making dunk shots,amassing nuclear weapons,losing weight,singing jazz songs,developing new technologies ,playing drums
Romona Mccain, 20000365, DS, commanding Roman legions,playing basketball,seducing women,ruining an empire,punching out Nazis,pushing dodgy operating systems,appreciating vintage collectibles,scandalizing polite society,tracking down criminals,gossiping with galpals
Shelley Brewer, 20000113, DS, looking for hidden treasures,chasing electronic ghosts,gossiping with galpals,shagging spies,selling out,attacking consumerism,playing rock guitar,finding clues,pioneering new technologies,watching MacGyver reruns
Leopoldo Embry, 20000291, DS, attacking consumerism,tossing coins,smoking Laramie Hi-Tars,spying for the enemy,looking for hidden treasures,studying science,pioneering new technologies,selling fast food,causing mayhem,pushing dodgy operating systems
Evangeline Benitez, 20000276, CS, writing rock songs,making kitsch,singing rock songs,promoting conservative values, fighting with swords,ranting about liberals,seducing miltary officers,blanketing staff with memos,test-driving cars,writing pop songs
Stephen Lloyd, 20000499, CS, enriching uranium,raising cain,stabbing in the back,promoting conservative values,campaigning for world peace,singing pop songs,amassing weapons,playing drums,starring in Hollywood movies,making threatening phone calls
Margaret Martinez, 20000056, DS, practicing good skin care,pinching pennies,kicking ass,attacking consumerism,seducing women,fighting in gladiator arenas,running a business empire,subverting social conventions,seeking revenge,gadding about town
Kathryn Ramirez, 20000041, DS, keeping a diary,starring in Hollywood movies,preventing crime,solving crimes,promoting the Dark Side,tricking criminals,pursuing criminals,solving mysteries,looking for hidden treasures,interviewing celebrities
Irene Delgado, 20000402, DS, suppressing minorities,attacking consumerism,bending the law,treating diseases,foiling the schemes of evil villains,defending the weak,cross-dressing in women's clothes,practicing good skin care,burning the wicked,enriching uranium
Cory Lytle, 20000379, CS, performing moon walks,spreading revolution,writing pop songs,making billions,engaging in hapless hijinks,writing romantic poetry,writing rock songs,singing pop songs,playing drums,ordering wire-taps
Melaine Coffin, 20000390, CS, ruining an empire,writing pop songs,test-driving cars,promoting conservative values,playing drums,spreading philosophy,ordering wire-taps,selling kitsch,running assembly lines,spreading revolution
Hisako Winslow, 20000328, DS, interpreting evidence,smoking cigarettes,selling out,causing mayhem,pushing dodgy operating systems,looking for hidden treasures,running a business empire,spying for the enemy,fighting in gladiator arenas,punching out Nazis
Craig Rogers, 20000008, DS, defending the weak,bursting out of shirts,interviewing celebrities,bending the law,milking coconuts,promoting greed,smoking cigarettes,enriching uranium,suppressing minorities,developing military strategies
Adriene Orlando, 20000330, CS, launching cultural revolutions,building a search engine,writing short stories,healing the sick,making kitsch,decrying secrecy,promoting pacifism,singing rock songs,seducing women,playing pop music
Luigi Mccray, 20000315, CS, starring in Hollywood movies,hosting automotive shows,amassing wealth,running a tech giant,writing pop songs,spreading revolution,making political gaffes,running assembly lines,seducing women,ordering wire-taps
Arnold Little, 20000105, CS, starring in sit-coms,test-driving cars,promoting new technologies,wielding political power,ruling over subjects,mass-producing cars,leaking classified documents,singing jazz songs,making billions,singing country music
Liana Stinnett, 20000235, DS, bursting out of shirts,fighting with swords,leading revolts,playing drums,singing jazz songs,chasing electronic ghosts,seeking revenge,selling out,developing military strategies,studying science
Kathleen Fields, 20000469, CS, mass-producing cars,promoting charity,writing pop songs,running a business empire,performing moon walks,struggling with modern times,ordering wire-taps,knocking out opponents,twirling a cane,promoting new technologies
Matilda Mangum, 20000275, DS, looking for hidden treasures,milking coconuts,piquing public interest,gossiping with galpals,running a hardware company,fighting in gladiator arenas,promoting new technologies,playing drums,tricking criminals,starring in daytime soap operas
Janine Albert, 20000340, CS, chasing after women,singing pop songs,singing rock songs,promoting racial harmony,writing pop songs,exploring foreign countries,seducing women,promoting circus attractions,running an empire,winning battles
Elizabeth Lopez, 20000064, DS, playing basketball,fighting the forces of good,treating diseases,representing criminals,causing mayhem,playing drums,spying for the enemy,preventing crime,subverting social conventions,suppressing minorities
Robert Gray, 20000082, CS, raising cain,hacking into computers,singing rock songs,funding a cure for malaria,singing pop songs,promoting charity,ruining an empire,writing rock songs,developing cunning plans,mass-producing cars
Annis Bourque, 20000337, DS, plotting with the enemy,writing rap songs,attacking consumerism,tricking criminals,promoting conservative values,chasing electronic ghosts,practicing good skin care,interviewing politicians,duelling acrobatically,promoting greed
Sherrie Felton, 20000319, CS, blanketing staff with memos,wielding political power,offering advice,starring in Hollywood movies,ruling over subjects,selling military secrets,developing cunning plans,amassing weapons,ordering wire-taps,test-driving cars
Billy Garcia, 20000003, CS, promoting new wars,making unauthorized sex tapes,making kitsch,singing pop songs,selling kitsch,writing pop songs,promoting charity,developing new technologies ,shilling for rental car companies,making dunk shots
Shemika Read, 20000243, DS, preventing crime,seeking revenge,promoting the Dark Side,plotting with the enemy,making soap,singing jazz songs,spreading revolution,inventing electrical marvels,selling fast food,looking for love
Patti Wright, 20000421, CS, chasing after women,making dunk shots,promoting new technologies,engaging in hapless hijinks,selling military secrets,performing moon walks,writing rock songs,writing pop songs,making political gaffes,playing drums
Francesco Fortune, 20000244, CS, starring in sit-coms,ranting about liberals,writing pop songs,hacking into computers,coining sparkling witticisms,seducing miltary officers,developing new technologies ,losing weight,ruling over subjects,decrying secrecy
Alison Sharp, 20000194, DS, acting off-off-Broadway,drinking too much red wine,interpreting evidence,subverting social conventions,milking coconuts,punching out Nazis,working for the forces of darkness,causing mayhem,terrorizing employees,keeping a diary
Morgan Libby, 20000288, CS, singing pop songs,singing rock songs,running for the senate,decrying secrecy,engaging in hapless hijinks,playing drums,producing Hipbop records,hacking into computers,singing country music,making witty remarks
Larry Rose, 20000407, DS, burning the wicked,writing rap songs,spying for the enemy,interpreting evidence,interviewing celebrities,practicing good skin care,duelling acrobatically,spreading revolution,knocking out opponents,ruining an empire
Jim Bailey, 20000172, CS, ruling over subjects,test-driving cars,struggling with modern times,starring in sit-coms,singing pop songs,hacking into computers,ordering wire-taps,promoting circus attractions,wielding political power,attacking neighbors
