Amiee Thacker, 20000212, DS, making dunk shots,tricking criminals,pursuing criminals,communicating with animals,running a multinational corporation,fighting guerilla wars,extracting confessions,solving mysteries,wanting to be a real person,killing teenagers
Kelly Johnston, 20000456, CS, crushing dissent,judging legal cases,promoting Heliocentrism,starring in indy movies,hiding from the public,abusing minorities,fighting for democracy,writing rap songs,interviewing politicians,racking up marriages
Claretha Newberry, 20000304, DS, eating donuts,instigating rebellion,arresting drug dealers,extracting confessions,tending the garden,smoking Boyard cigarettes,looking after children,killing demons,promoting Catholic values,obsessively washing hands
Sharilyn Tyson, 20000341, DS, smoking cigars,foiling the schemes of evil villains,climbing social ladders,eluding capture,holding evasive press conferences,starring in Hollywood movies,licking frogs,traveling in time,performing magic tricks,diagnosing diseases
Genevie Delvalle, 20000309, DS, promoting Heliocentrism,drinking Duff beer,cooking a rabbit stew,fighting in gladiator arenas,smoking cigars,hunting monsters,delivering judgments,composing advertizing jingles,seducing young women,looking for love
Rose Thompson, 20000050, DS, promoting wickedness,attacking neighbors,talking to mirrors,promoting Darwinism,climbing social ladders,surviving in a post-apocalyptic world,teaching the next generation,running a hardware company,hunting demons,communicating with animals
Isis Oglesby, 20000237, DS, running a crime family,racking up marriages,running a criminal empire,making dunk shots,fighting for the rebel alliance,solving mysteries,performing magic tricks,attacking consumerism,tempting the innocent,dating young women
Rachel Nelson, 20000087, DS, creating nightmares,solving mysteries,interpreting evidence,conducting illicit affairs,searching for the messiah,doing the Charleston,making ice sculptures,preventing crime,attending cocktail parties,running a hotel
Jeremy Gonzales, 20000016, CS, singing rock songs,arresting criminals,writing on wax tablets,writing pop songs,selling military secrets,cross-dressing in women's clothes,racking up marriages,ranting about liberals,promoting racial harmony,spying for the enemy
Jessi Chang, 20000321, DS, smoking Silk Cut cigarettes,playing golf,tending the garden,promoting democracy,preparing for war,building an army,raging against the machine,starring in Hollywood movies,meddling in the dark arts,rescuing prisoners of war
Dana Vega, 20000139, DS, devising evil schemes,teaching magic,seducing young women,running a criminal empire,manipulating political pawns,living amongst apes,gadding about town,composing advertizing jingles,deep-frying chicken,licking frogs
Sarah Curtis, 20000468, DS, composing advertizing jingles,starring in indy movies,wanting to be a real person,promoting yellow journalism,eating carrots,twirling a cane,tracking down criminals,amassing wealth,seeking revenge,solving crimes
Arminda Mccloud, 20000242, DS, promoting wickedness,offering legal advice,teaching magic,reporting the news,striving for world domination,cooking a rabbit stew,following clues,promoting healthy eating,killing teenagers,killing rival gladiators
Sherie Lerner, 20000259, CS, lying on the stand,directing animated films,leading armies into battle,avoiding taxes,winning boxing matches,starring in Hollywood movies,teaching philosophy to future leaders,running a media empire,writing rock songs,dining with playboy princes
Valentine Villegas, 20000351, CS, promoting communism,fighting with swords,singing pop songs,writing pop songs,jumping on couches,running an empire,running a criminal enterprise,solving crimes,promoting Catholic values,terrorizing employees
Bertie Dell, 20000234, CS, singing torch songs,gyrating hips,explaining evolution,crooning love songs,writing plays,running a crime family,lying on the stand,winning boxing matches,pioneering new technologies,singing pop songs
Cindy Ruiz, 20000479, CS, designing clothes,cracking enemy codes,composing classical music,promoting conservative values,racking up marriages,performing moon walks,seducing women,running an empire,manipulating ingenues,leading armies into battle
Cyndi Vance, 20000239, CS, commiting perjury,doing stand-up,singing pop songs,spreading Christianity,running a criminal enterprise,climbing social ladders,postulating bizarre theories,leading armies into battle, spreading revolution,developing open-source software
Geneva Nunez, 20000144, DS, performing magic tricks,bridging cultures ,slashing victims,eluding authorities,inventing time machines,kicking ass,devising evil schemes,foiling the schemes of evil villains,drawing whimsical cartoons,seducing women
Annmarie Toney, 20000393, CS, teaching philosophy,over-acting,eating bugs,directing animated films,writing pop songs,spreading revolution,ranting about liberals,wielding political power,rooting out facts,eluding authorities
Charles Baker, 20000430, DS, instigating rebellion,preaching tolerance,hunting monsters,plotting with the enemy,promoting democracy,playing pranks,treating diseases,promoting Catholic values,attacking neighbors,killing demons
Fumiko Osorio, 20000385, CS, promoting racial harmony,seducing women,dining with playboy princes,offering gnostic advice,pedalling furiously,launching cultural revolutions,singing pop songs,developing open-source software,solving mysteries,going for a spacewalk
Liana Stinnett, 20000235, CS, winning heavyweight titles,abusing minorities,selling cosmetics,writing plays,running a kingdom,pushing haute couture,writing hawkish memos,slashing victims,making threatening phone calls,starring in indy movies
Denise Campbell, 20000010, CS, singing rock songs,promoting conservative values,proving math theorems,promoting Scientology,winning heavyweight titles,running a media empire,running a movie studio,changing sides,writing pop songs,wielding political power
Tracy Holmes, 20000136, DS, traveling in time,seducing women,tormenting muggles,making vulgar jokes,avenging loved ones,smoking Silk Cut cigarettes,killing monsters,hunting monsters,living amongst apes,smoking Boyard cigarettes
Sophie Stokes, 20000428, DS, eluding capture,reading minds,looking for love,trimming bushes,engaging in bare-knuckle fighting,interpreting evidence,starring in Hollywood movies,making patronising comments,finding clues,running a school for gifted teens
Jamie Brewer, 20000405, CS, developing real estate,running a media empire,spreading philosophy,promoting circus attractions,teaching philosophy to future leaders,solving crimes,writing rock songs,starring in indy movies,piquing public interest,running Ponzi schemes
Roger Roberts, 20000021, CS, launching cultural revolutions,starring in indy movies,writing pop songs,ruining an empire,healing the sick,running a movie studio,recruiting dissidents,pioneering new technologies,making vulgar jokes,developing operating systems
Domingo Greer, 20000165, CS, opening a new front,cheating clients,cooking dinners,developing new technologies ,playing drums,ranting about liberals,starring in Hollywood movies,developing open-source software,directing animated films,singing pop songs
Penny Grant, 20000425, DS, maintaining a secret identity,seducing women,kicking ass,hunting demons,running a smuggling business,extracting confessions,launching hostile takeovers,teaching young mutants,killing teenagers,smoking Silk Cut cigarettes
Sean Russell, 20000062, DS, starring in Hollywood movies,engaging in bare-knuckle fighting,running a hotel,performing kung-fu moves,running a clandestine spy organization,performing office chores,foiling the schemes of evil villains,amassing wealth,racking up marriages,running a school for gifted teens
Sharilyn Tyson, 20000341, DS, traveling in time,launching hostile takeovers,doing the Kessel run,foiling the schemes of evil villains,deep-frying chicken,fighting the forces of good,practicing insincerity,making patronising comments,tormenting muggles,engaging in bare-knuckle fighting
Roselyn Schott, 20000331, CS, directing animated films,promoting political causes,making vulgar jokes,singing pop songs,writing rap songs,raising cain,cooking dinners,promoting Heliocentrism,writing pop songs,telling politicians what to do
Marlen Poston, 20000387, CS, seducing miltary officers,pushing haute couture,deflating political egos,singing rock songs,proving math theorems,offering gnostic advice,pioneering new technologies,promoting enlightenment,ruling over subjects,writing rock songs
Terence Richards, 20000458, DS, tricking criminals,building an army,drinking Duff beer,developing new technologies ,attacking neighbors,running a smuggling business,foiling the schemes of evil villains,instigating rebellion,devising evil schemes,smoking Silk Cut cigarettes
Elroy Miner, 20000253, CS, organizing a putsch,doing stand-up,healing the sick,ordering wire-taps,amassing nuclear weapons,promoting Scientology,writing pop songs,winning heavyweight titles,manipulating ingenues,jumping on couches
Fernando Fisher, 20000124, DS, living amongst apes,promoting healthy eating,tracking down criminals,expressing violent urges,smoking Boyard cigarettes,seducing young women,running a kingdom,conducting illicit affairs,killing demons,practicing the Occult
Terry Flores, 20000055, CS, running for the senate,abusing minorities,singing pop songs,going for a spacewalk,recruiting dissidents,eluding authorities,amassing nuclear weapons,promoting atheism,chasing after women,doing slapstick comedy
Jamie Brewer, 20000405, CS, over-acting,writing pop songs,directing science fiction movies,commiting perjury,writing hawkish memos,popping amphetamines,dining with playboy princes,making maverick choices,writing modern fiction,ranting about liberals
Masako Moreau, 20000395, CS, singing pop songs,making insipid musicals,dating centrefolds,writing pop songs,healing the sick,building giant walls,interpreting evidence,teaching philosophy to future leaders,jumping on couches,developing open-source software
Gerald Collins, 20000093, DS, wanting to be a real person,expressing violent urges,running a criminal empire,clipping coupons,keeping a diary,smoking herb,seducing women,traveling in time,running a software company,singing pop songs
Virgil Jacobs, 20000500, CS, slashing victims,promoting conservative values,blanketing staff with memos,singing pop songs,running Ponzi schemes,writing mystery stories,promoting Catholic values,writing pop songs,making science fiction movies,starring in indy movies
Virgil Jacobs, 20000500, CS, running for the senate,starring in indy movies,building a wooden ark,ruining an empire,promoting Darwinism,composing classical music,commanding a spaceship,leading armies into battle,ordering wire-taps,interviewing politicians
Antony Marchand, 20000270, CS, running a media empire,singing jazz songs,promoting political causes,patenting new technologies ,promoting conservative values,winning boxing matches,leading armies into battle,making cartoons,running restaurants,racking up marriages
Vanessa Page, 20000471, CS, running Ponzi schemes,building airplanes,promoting new technologies,singing pop songs,ordering wire-taps,writing modern fiction,eluding authorities,making movies,leading armies into battle,writing pop songs
Debi Lange, 20000381, DS, losing control,running a criminal empire,fighting for the rebel alliance,wanting to be a real person,piloting a spaceship,pioneering new technologies,interpreting evidence,making ice sculptures,living amongst apes,solving crimes
Virginia Moody, 20000435, CS, leading revolts,playing drums,singing middle-of-the-road songs,interviewing politicians,promoting pacifism,pioneering new technologies,chasing criminals,running a movie studio,starring in romantic comedies,singing pop songs
Letisha Handy, 20000217, CS, starring in Hollywood movies,producing Hipbop records,building a wooden ark,promoting Catholic values,commiting perjury,singing torch songs,singing Hipbop songs,developing new technologies ,pedalling furiously,leading armies into battle
Drema Saylor, 20000376, CS, writing on wax tablets,solving mysteries,wielding political power,writing pop songs,chasing after women,pushing haute couture,developing open-source software,playing drums,promoting conservative values,writing cook books
Kira Earl, 20000343, CS, playing drums,promoting conservative values,wielding political power,spreading revolution,recruiting dissidents,grilling interviewees,writing pop songs,manipulating political pawns,over-acting,singing Hipbop songs
King Seaton, 20000358, CS, promoting Catholic values,developing new technologies ,healing the sick,teaching philosophy to future leaders,starring in indy movies,staring at the moon,climbing social ladders,writing pop songs,cooking dinners,making insipid musicals
Katherine Morrison, 20000147, CS, starring in Hollywood movies,promoting Scientology,promoting conservative values,writing cook books,raising cain,running a media empire,leading revolts,doing stand-up,interviewing politicians,wielding political power
Craig Kelly, 20000164, CS, promoting political causes,over-acting,popping amphetamines,teaching philosophy to future leaders,leading armies into battle,singing country music,spying for the enemy,building giant walls,leading revolts,composing classical music
Dan Pope, 20000174, CS, cross-dressing in women's clothes,issuing threats,singing pop songs,ranting about religion,promoting democracy,commiting perjury,spreading political gossip,writing hawkish memos,starring in indy movies,eluding authorities
Larry Henning, 20000339, DS, selling fried chicken,recruiting dissidents,climbing social ladders,reporting the news,wanting to be a real person,watching MacGyver reruns,wielding political power,tricking criminals,teaching magic,promoting wickedness
Benjamin Chavez, 20000178, CS, making vulgar jokes,leading armies into battle,composing classical music,running a media empire,running Ponzi schemes,writing cook books,pedalling furiously,developing new technologies ,promoting Darwinism,punishing crime
Jeannette Owen, 20000489, CS, spreading philosophy,interviewing politicians,running a movie studio,collecting treasures,ruling over subjects,selling tickets,fighting with swords,leading armies into battle,winning boxing matches,lying on the stand
Javier Long, 20000424, CS, directing animated films,making science fiction movies,building houses for poor people,winning boxing matches,pioneering new technologies,amassing weapons,teaching philosophy,cross-dressing in women's clothes,eating bugs,starring in Hollywood movies
Lee Klein, 20000104, CS, seducing miltary officers,making fantasy movies,manipulating ingenues,writing pop songs,promoting Catholic values,writing poetry,raising cain,winning heavyweight titles,running restaurants,hiding from the public
Kathryn Ramirez, 20000041, DS, talking to mirrors,chasing flappers,bridging cultures ,preventing crime,eating donuts,writing pop songs,keeping accounts,killing teenagers,condescending to customers,tracking down criminals
Genevieve Rowe, 20000101, DS, tending the garden,devising evil schemes,promoting communism,developing new technologies,pursuing criminals,teaching young mutants,plotting with the enemy,promoting Catholic values,bridging cultures ,losing control
Kira Earl, 20000343, CS, fighting with swords,pioneering new technologies,running a media empire,writing hawkish memos,directing animated films,promoting new technologies,starring in indy movies,promoting political causes,singing pop songs,pedalling furiously
Luz Jordan, 20000482, DS, stealing human fat,terrorizing employees,performing household chores,playing pranks,finding clues,avoiding growing old,solving mysteries,promoting mysticism,inventing time machines,punching out Nazis
Daniel Hill, 20000048, DS, running a kingdom,seducing miltary officers,watching MacGyver reruns,killing rival gladiators,wanting to be a real person,killing teenagers,communicating with animals,tempting the innocent,digging for antiquities,fighting the forces of good
Marta Gray, 20000477, CS, explaining evolution,going for a spacewalk,fighting with swords,launching cultural revolutions,developing operating systems,ranting about liberals,writing rap songs,doing stand-up,singing jazz songs,making threatening phone calls
Cheryl Wells, 20000193, CS, writing rock songs,promoting circus attractions,arresting criminals,shilling for rental car companies,raising cain,slashing victims,spreading philosophy,promoting conservative values,writing pop songs,going for a spacewalk
Lela Garza, 20000466, CS, starring in indy movies,promoting Heliocentrism,womanizing,pedalling furiously,making insipid musicals,writing pop songs,doing stand-up,eluding authorities,developing open-source software,finding clues
Shelley Brewer, 20000113, CS, running an empire,over-acting,writing hawkish memos,abusing minorities,promoting conservative values,fighting with swords,running a technology company,searching for the messiah,winning boxing matches,running restaurants
Marcel Traylor, 20000293, DS, duelling acrobatically,promoting Heliocentrism,devising evil schemes,meddling in the dark arts,killing monsters,composing advertizing jingles,punishing criminals,pedalling furiously,promoting charity,extracting confessions
Amiee Thacker, 20000212, DS, killing demons,starring in daytime soap operas,solving crimes,delivering judgments,extracting confessions,smoking Boyard cigarettes,playing rock music,preparing for war,knocking out opponents,making patronising comments
Marcela Hinson, 20000360, DS, raging against the machine,solving crimes,finding clues,composing classical music,foiling the schemes of evil villains,avoiding growing old,promoting capitalism,attacking consumerism,terrorizing employees,drinking Duff beer
Garry Rios, 20000423, DS, making patronising comments,killing demons,preparing for war,chasing after women,launching hostile takeovers,promoting capitalism,condescending to customers,running a hardware company,watching MacGyver reruns,teaching magic
Drema Saylor, 20000376, DS, expressing violent urges,planning confidence tricks,playing pranks,keeping accounts,piloting a spaceship,living amongst apes,launching hostile takeovers,solving mysteries,breaking bones,deep-frying chicken
Stacey Roy, 20000137, DS, solving crimes,teaching magic,unearthing ancient tombs,duelling acrobatically,pioneering new technologies,selling out,smoking herb,killing teenagers,running a school for gifted teens,hunting monsters
Diana Baker, 20000004, DS, licking frogs,foiling the schemes of evil villains,eluding authorities,interpreting evidence,surviving in a post-apocalyptic world,spying for the enemy,starring in comedies,promoting capitalism,promoting the Dark Side,killing monsters
Hsiu Mattos, 20000236, CS, chasing after women,ranting about religion,promoting conservative values,raising cain,promoting Scientology,singing pop songs,writing rock songs,fighting with swords,campaigning for the presidency,writing pop songs
Yelena Ratliff, 20000282, CS, fighting for democracy,cooking dinners,writing hawkish memos,building giant walls,writing novels,recruiting dissidents,designing clothes,developing new technologies ,abusing minorities,going for a spacewalk
Joni Velasquez, 20000210, CS, ordering wire-taps,promoting conservative values,manipulating ingenues,writing rock songs,leading armies into battle,promoting Heliocentrism,pioneering new technologies,singing pop songs,promoting pacifism,teaching philosophy
Amanda Barnes, 20000095, DS, condescending to customers,tricking criminals,promoting Darwinism,making vulgar jokes,swinging from tree to tree,interpreting evidence,making ice sculptures,playing rock guitar,turning it up to 11,clipping coupons
Gregory Cook, 20000052, CS, bridging cultures ,writing poetry,teaching the next generation,writing pop songs,winning boxing matches,interviewing politicians,chasing after women,making insipid musicals,ranting about liberals,explaining natural selection
Lovella Sumner, 20000262, DS, making home-made clothes,tracking down criminals,killing teenagers,finding clues,studying magic tricks,building an army,selling fried chicken,chasing flappers,seducing young women,teaching the next generation
Jason Holloway, 20000118, DS, turning it up to 11,bridging cultures ,grabbing power,rescuing prisoners of war,reporting the news,practicing the Occult,manipulating political pawns,looking after children,kicking ass,teaching young mutants
Gabriel Webster, 20000161, DS, meddling in the dark arts,starring in Hollywood movies,teaching young mutants,studying icons,deep-frying chicken,attending cocktail parties,making ice sculptures,making dunk shots,eluding capture,tending the garden
Gerald Collins, 20000093, CS, singing country music,healing the sick,running a crime family,developing open-source software,teaching philosophy to future leaders,performing moon walks,directing animated films,searching for the messiah,running for the senate,writing pop songs
Joseph Bailey, 20000091, CS, promoting Darwinism,running a media empire,developing real estate,writing plays,chasing after women,raising cain,developing operating systems,leading armies into battle,promoting conservative values,recruiting dissidents
Myron Valdez, 20000153, CS, seducing miltary officers,directing animated films,running a movie studio,writing pop songs,making movies,promoting conservative values,starring in Hollywood movies,playing drums,fighting with swords,promoting political causes
Genevive Schofield, 20000222, CS, amassing weapons,directing animated films,cooking dinners,bridging cultures ,spreading revolution,writing novels,launching cultural revolutions,running for the senate,cross-dressing in women's clothes,singing middle-of-the-road songs
Antony Marchand, 20000270, DS, milking coconuts,devising evil schemes,spying for the enemy,making condescending remarks,practicing the Occult,starring in reality TV shows,talking to mirrors,amassing wealth,killing teenagers,punishing criminals
Karen Bell, 20000157, CS, gyrating hips,starring in Hollywood movies,playing drums,ordering wire-taps,building giant walls,womanizing,teaching philosophy to future leaders,singing pop songs,interviewing politicians,promoting Darwinism
Teena Hallman, 20000263, DS, offering legal advice,clipping coupons,instigating rebellion,unearthing ancient tombs,running a software company,duelling acrobatically,attending cocktail parties,beating menial staff,teaching young mutants,performing magic tricks
Dominica Otero, 20000206, CS, fighting with swords,producing Hipbop records,winning heavyweight titles,changing sides,teaching philosophy,writing cook books,manipulating ingenues,surviving large-scale floods,blanketing staff with memos,teaching philosophy to future leaders
Melaine Coffin, 20000390, DS, leading revolts,solving mysteries,drinking Duff beer,knocking out opponents,smoking cigars,teaching young mutants,trimming bushes,keeping accounts,performing magic tricks,representing criminals
Shawn Hall, 20000019, DS, living amongst apes,being condescending to customers,trimming bushes,preparing for war,running a crime family,interpreting evidence,expressing violent urges,finding clues,publishing newspapers,starring in Hollywood movies
Preston Rogers, 20000175, CS, singing pop songs,leading armies into battle,judging legal cases,ordering wire-taps,promoting new technologies,promoting charity,selling tickets,terrorizing employees,designing clothes,preaching to presidents
Adriene Orlando, 20000330, CS, writing pop songs,running a criminal enterprise,writing cook books,doing diet commercials,eluding authorities,producing Hipbop records,writing poetry,explaining evolution,leading armies into battle,suppressing minorities
Benjamin Thomas, 20000032, CS, running a crime family,running a kingdom,promoting conservative values,doing slapstick comedy,promoting Heliocentrism,bridging cultures ,recruiting dissidents,promoting Darwinism,cooking dinners,winning boxing matches
Kelly Johnston, 20000456, DS, running a criminal empire,making home-made clothes,tempting the innocent,drinking Duff beer,looking for love,piloting the Millenium Falcon,striving for world domination,making ice sculptures,solving crimes,performing household chores
King Seaton, 20000358, DS, trimming bushes,beating menial staff,clipping coupons,fighting for democracy,building an army,practicing the Occult,plotting with the enemy,teaching young mutants,hunting demons,tormenting muggles
Benjamin Chavez, 20000178, CS, interviewing celebrities,pioneering new technologies,selling tickets,writing pop songs,wielding political power,enriching uranium,blanketing staff with memos,promoting political causes,ranting about liberals,interviewing politicians
Joline Hinds, 20000250, DS, performing magic tricks,solving crimes,arresting drug dealers,extracting confessions,smoking Silk Cut cigarettes,finding clues,piloting the Millenium Falcon,smoking herb,racking up marriages,solving mysteries
Pablo Moore, 20000443, CS, singing pop songs,running an empire,writing pop songs,hiding from the public,jumping on couches,spreading philosophy,writing rock songs,going for a spacewalk,promoting Scientology,healing the sick
Joan Taylor, 20000083, CS, making cartoons,singing pop songs,manipulating ingenues,doing stand-up,running a media empire,hiding from the public,changing sides,teaching philosophy to future leaders,arresting criminals,running a movie studio
Olga Copeland, 20000163, DS, swinging from tree to tree,fighting for the rebel alliance,solving crimes,developing new technologies,engaging in bare-knuckle fighting,foiling the schemes of evil villains,making home-made clothes,smoking Boyard cigarettes,plotting with the enemy,arresting drug dealers
