Elizabeth Lopez, 20000064, CS, running a kingdom,enriching uranium,running a frontier town,directing bad movies,seducing women,studying mathematics,making unauthorized sex tapes,coining sparkling witticisms,writing Hollywood movies,promoting Catholic values
Lorine Linkous, 20000334, CS, patenting new technologies ,writing TV comedies,playing the banjo,pioneering new technologies,making threatening phone calls,writing political tracts,playing jazz trumpet,terrorizing employees,writing modern fiction,solving crimes
Antony Marchand, 20000270, CS, starring in Hollywood movies,running a software company,doing stand-up,singing pop songs,giving investment advice,wielding political power,amassing wealth,test-driving cars,testing new technologies,expressing dissent
Jade Arthur, 20000215, DS, trimming bushes,ruling over subjects,tracking down criminals,duelling acrobatically,pursuing criminals,making soap,promoting hair products,devising evil schemes,collecting treasures,fighting in gladiator arenas
Eufemia Mcduffie, 20000368, CS, fighting with swords,punishing crime,scandalizing polite society,directing science fiction movies,wielding political power,giving investment advice,writing Hollywood movies,writing modern fiction,promoting Scientology,spreading political gossip
Louise Martin, 20000054, CS, promoting Catholic values,starring in comedies,terrorizing employees,playing the clarinet,writing modern fiction,directing Hollywood movies,ranting about liberals,singing pop songs,testing new technologies,giving investment advice
Willette Rudd, 20000323, CS, making cartoons,singing country music,fighting with swords,fighting for democracy,gyrating hips,singing the blues,running a media empire,writing modern fiction,playing jazz trumpet,singing pop songs
Lorinda Dykes, 20000213, DS, interviewing politicians,flying into a rage,leading revolts,hunting monsters,playing rock music,tricking criminals,terrorizing sleepers,cross-dressing in women's clothes,stealing human fat,apprehending criminals
Jasmin Chadwick, 20000279, DS, smoking Silk Cut cigarettes,spreading revolution,tracking down criminals,running a kingdom,spreading political gossip,extracting confessions,promoting socialism,ruling over subjects,reporting the news,pioneering new technologies
Rosaline Flagg, 20000318, CS, collecting treasures,collecting rock samples,running a frontier town,climbing social ladders,promoting conservative values,scandalizing polite society,spreading philosophy,delivering judgments,writing pop songs,worrying about health
Carl Morgan, 20000002, CS, running a kingdom,seducing women,writing pop songs,making movies,gyrating hips,running Ponzi schemes,giving investment advice,fighting for democracy,promoting conservative values,living amongst apes
Keisha Naquin, 20000335, DS, spreading political gossip,offering medical opinions,duelling acrobatically,publishing newspapers,solving crimes,pioneering new technologies,solving mysteries,running a multinational corporation,reading minds,preventing crime
Romona Mccain, 20000365, CS, going for a spacewalk,preventing crime,promoting humanism,ruling over subjects,writing rock songs,making unauthorized sex tapes,solving mysteries,pioneering new technologies,running a smuggling business,hosting automotive shows
Matilda Mangum, 20000275, DS, interviewing politicians,performing magic tricks,tricking criminals,writing purple prose,duelling acrobatically,running a multinational corporation,promoting tolerance,tracking down criminals,running a school for gifted teens,interviewing celebrities
Maxima Talley, 20000249, CS, singing the blues,writing rock songs,womanizing,making kitsch,singing rock songs,selling fast food,coining epigrams,interviewing politicians,coining sparkling witticisms,playing drums
Samuel Fields, 20000158, CS, grabbing power,wielding political power,writing political tracts,punishing crime,writing rock songs,taking anabolic steroids,writing rap songs,making political gaffes,leading armies into battle,amassing nuclear weapons
Bill Chavez, 20000408, DS, eluding capture,leading revolts,running for governor,starring in Hollywood movies,promoting tolerance,stealing human fat,fighting the forces of good,interviewing politicians,promoting hair products,promoting conservative values
Jerald Cruz, 20000497, DS, keeping a diary,creating nightmares,eating census takers,tempting the innocent,living amongst apes,pursuing criminals,singing pop songs,looking after children,stealing human fat,starring in Hollywood movies
Jimmy Klein, 20000426, CS, promoting atheism,making unauthorized sex tapes,running a software company,writing modern fiction,promoting conservative values,promoting democracy,starring in Hollywood movies,running a media empire,coining epigrams,running pyramid schemes
Elizabeth Lopez, 20000064, DS, stealing human fat,making modern art,burping,defending the weak,starring in Hollywood movies,solving crimes,eluding capture,twirling a cane,teaching the next generation,pioneering new technologies
Gloria Vargas, 20000495, DS, hacking into computers,interpreting evidence,solving crimes,running pyramid schemes,keeping a diary,fighting for democracy,making ice sculptures,playing rock music,looking after children,hunting monsters
Olive Gordon, 20000181, DS, running a multinational corporation,smoking cigarettes,striving for world domination,interpreting evidence,performing Web searches,trading innuendo,fighting for the resistance,making soap,finding clues,analyzing murder scenes
Hsiu Mattos, 20000236, CS, gyrating hips,leading armies into battle,ruling over subjects,writing pop songs,grabbing power,running a software company,healing the sick,instigating rebellion,performing stand-up,making cartoons
Yelena Ratliff, 20000282, DS, running a multinational corporation,hunting monsters,keeping a diary,posing as a street thug,interpreting evidence,promoting tolerance,inventing electrical marvels,teaching the next generation,climbing social ladders,promoting circus attractions
Sue Pena, 20000455, CS, promoting Scientology,singing jazz songs,fighting with swords,writing Hollywood movies,proving math theorems,trading innuendo,directing bad movies,enriching uranium,selling fast food,womanizing
Kira Earl, 20000343, CS, writing pop songs,coining epigrams,promoting conservative values,writing plays,writing modern fiction,directing comedies,selling fast food,ranting about liberals,insulting minorities,building a search engine
Adrian Rose, 20000103, CS, wielding political power,hosting automotive shows,giving investment advice,singing pop songs,promoting conservative values,running a media empire,writing pop songs,promoting democracy,deflating political egos,warning about totalitarianism
Catherine Hernandez, 20000069, DS, seducing women,finding clues,maintaining a secret identity,fighting for justice,running a media empire,wielding political power,keeping a diary,meddling in the dark arts,pursuing criminals,dating young women
Daron Fort, 20000306, DS, engaging in bare-knuckle fighting,solving crimes,running a multinational corporation,going on commando missions,avenging loved ones,devising evil schemes,stealing human fat,explaining evolution,pursuing criminals,interpreting evidence
Calvin Garrett, 20000451, CS, fomenting social revolution,promoting democracy,warning about totalitarianism,singing Hipbop songs,seducing women,amassing nuclear weapons,expressing dissent,wielding political power,writing TV comedies,patenting new technologies 
Karla Reeves, 20000461, CS, plotting mutinies,singing pop songs,writing rock songs,running a kingdom,making modern art,starring in comedies,seducing women,making cartoons,promoting conservative values,undermining authority
Craig Rogers, 20000008, DS, singing bawdy songs,smoking Silk Cut cigarettes,performing household chores,ruling over subjects,punishing criminals,hacking into computers,twirling a cane,maintaining a secret identity,burping,apprehending criminals
Yuri Oliva, 20000254, DS, fighting for the rebel alliance,punishing criminals,revelling in blood spatter,promoting conservative values,solving mysteries,tracking down criminals,cheating at poker,chasing terrorists,fighting for justice,killing monsters
Mark Stewart, 20000081, DS, selling fast food,smoking cigarettes,impersonating women,playing rock music,belching,eating census takers,pursuing criminals,performing household chores,tricking criminals,cross-dressing in women's clothes
Mark Stewart, 20000081, CS, preventing crime,promoting new technologies,running an empire,starring in comedies,writing romantic poetry,searching for the messiah,promoting atheism,spreading philosophy,promoting Catholic values,designing clothes
Stephanie Clark, 20000073, CS, ranting about liberals,promoting communism,manipulating ingenues,playing the banjo,starring in Hollywood movies,fighting for civil rights,singing pop songs,writing rap songs,writing polemics,running a media empire
Willette Rudd, 20000323, CS, wielding political power,ranting about liberals,singing torch songs,staring at the moon,promoting conservative values,directing Hollywood movies,running pyramid schemes,pioneering new technologies,starring in Hollywood movies,playing jazz trumpet
Tonya Walton, 20000179, CS, directing movies,writing pop songs,writing plays,directing comedies,writing modern fiction,patenting new technologies ,campaigning for the presidency,performing stand-up,building airplanes, fighting for democracy
Jason Holloway, 20000118, CS, singing pop songs,ranting about liberals,running a frontier town,promoting conservative values,wielding political power,ruling over subjects,crushing dissent,campaigning for the presidency,womanizing,writing about social problems
Theresa Pratt, 20000416, CS, healing the sick,making kitsch,tolerating adultery,warning about totalitarianism,telling politicians what to do,writing pop songs,popping amphetamines,going for a spacewalk,making unauthorized sex tapes,singing pop songs
Benjamin Chavez, 20000178, DS, impersonating women,rescuing damsels in distress,finding clues,spreading political gossip,solving mysteries,flying into a rage,tricking criminals,making soap,treating diseases,making ice sculptures
Setsuko Prescott, 20000391, CS, promoting air travel,writing modern fiction,pioneering new technologies,insulting minorities,ruling over subjects,writing polemics,promoting new technologies,writing romantic poetry,collecting rock samples,stabbing in the back
Val Zuniga, 20000342, CS, building airplanes,pedalling furiously,issuing threats,marrying underage girls,scandalizing polite society,teaching philosophy to future leaders,wielding political power,running a media empire,coining sparkling witticisms,directing science fiction movies
Caleb Perez, 20000450, CS, scandalizing polite society,running a kingdom,starring in Hollywood movies,smoking Boyard cigarettes,fighting with swords,promoting movie violence,promoting new technologies,playing rock piano,pioneering new technologies,ruling over subjects
Joni Velasquez, 20000210, DS, promoting hair products,practicing the Occult,eluding capture,finding clues,solving crimes,apprehending criminals,performing kung-fu moves,punishing terrorists,tricking criminals,casting magic spells
Lou Koch, 20000207, DS, singing bawdy songs,solving mysteries,hosting automotive shows,striving for world domination,fighting for the resistance,eluding authorities,rescuing damsels in distress,extracting confessions,pulling dirty political tricks,preventing crime
China Hendricks, 20000364, CS, running assembly lines,jumping on couches,wielding political power,writing pop songs,trading innuendo,writing TV comedies,eluding authorities,promoting movie violence,writing Hollywood movies,worrying about health
Shemika Read, 20000243, DS, promoting conservative values,interviewing politicians,running a school for gifted teens,smoking cigarettes,pursuing criminals,preparing for war,going on commando missions,promoting diversity,pioneering new technologies,pinching pennies
Rossana Denton, 20000251, DS, killing rival gladiators,studying magic,hacking into computers,fighting for the resistance,fighting the forces of good,trimming bushes,attending cocktail parties,arresting criminals ,causing mayhem,drinking demon blood
Rose Thompson, 20000050, CS, promoting pacifism,scandalizing polite society,writing romantic poetry,promoting new technologies,solving crimes,amassing wealth,coining epigrams,writing short stories,piloting a spaceship,seducing women
Charlie Gibson, 20000464, CS, writing Hollywood movies,writing pop songs,promoting conservative values,testing new technologies,interviewing celebrities,running a media empire,promoting pop music,starring in Hollywood movies,singing rock songs,worrying about health
Claudie Hahn, 20000286, DS, rescuing damsels in distress,climbing social ladders,practicing good skin care,reporting the news,singing bawdy songs,tempting the innocent,trading innuendo,terrorizing sleepers,promoting mysticism,defending the weak
Genevie Delvalle, 20000309, CS, staring at the moon,promoting Kaballah,promoting communism,scandalizing polite society,running a smuggling business,selling franchises,making political gaffes,cooking fancy food,launching cultural revolutions,building a search engine
Beverly Gilbert, 20000422, CS, running a kingdom,pioneering new technologies,popping amphetamines,leading armies into battle,singing pop songs,fighting with swords,puncturing artistic sensibilities,campaigning for the presidency,promoting socialism,singing torch songs
Billy Garcia, 20000003, CS, solving mysteries,avoiding taxes,starring in Hollywood movies,staring at the moon,making political gaffes,challenging artistic norms,singing the blues,writing plays,promoting humanism,ranting about liberals
Matilda Mangum, 20000275, CS, promoting conservative values,going for a spacewalk,interviewing politicians,collecting treasures,starring in Hollywood movies,hosting automotive shows,performing stand-up,lying on the stand,singing torch songs,insulting minorities
Marcela Hinson, 20000360, CS, singing pop songs,healing the sick,developing new technologies ,singing Hipbop songs,promoting democracy,pushing haute couture,betraying friends,developing military strategies,starring in comedies,running a smuggling business
Joanne Vaughn, 20000122, CS, promoting conservative values,delivering judgments,promoting atheism,singing pop songs,running an empire,selling fast food,writing pop songs,expressing dissent,starring in Hollywood movies,running a media empire
Linda Garner, 20000145, CS, performing stand-up,searching for the messiah,fighting with swords,singing pop songs,running a media empire,puncturing artistic sensibilities,enriching uranium,scandalizing polite society,making cartoons,running a kingdom
Bonita Billups, 20000255, DS, fighting for the resistance,finding clues,climbing social ladders,explaining evolution,promoting charity,apprehending criminals,killing demons,solving mysteries,killing teenagers,running a school for gifted teens
Sherrie Felton, 20000319, CS, ranting about liberals,writing TV comedies,selling kitsch,frowning at errant husbands,making cartoons,writing pop songs,searching for the messiah,singing pop songs,developing military strategies,writing modern fiction
Joan Taylor, 20000083, CS, writing plays,writing romantic poetry,running an empire,promoting movie violence,pioneering new technologies,seducing women,singing pop songs,making violent movies,promoting Heliocentrism,interviewing politicians
Daphne Reno, 20000345, CS, promoting democracy,promoting conservative values,running a kingdom,singing pop songs,wielding political power,ruling over subjects,writing polemics,starring in comedies,womanizing,pioneering new technologies
Gabriel Webster, 20000161, DS, inventing electrical marvels,womanizing,seeking revenge,finding clues,causing mayhem,preventing crime,solving crimes,composing classical music,seducing women,practicing insincerity
Latina Gunderson, 20000362, DS, performing magic tricks,solving mysteries,solving crimes,stealing human fat,bending spoons,teaching the next generation,leading revolts,trading innuendo,duelling acrobatically,wielding political power
Jeri Etheridge, 20000296, DS, smoking Silk Cut cigarettes,interviewing politicians,handing out flowers,trimming bushes,spreading political gossip,performing kung-fu moves,going on commando missions,fighting in gladiator arenas,promoting logical thinking,interpreting evidence
Frederic Crook, 20000209, CS, starring in comedies,leading revolts,running a kingdom,teaching philosophy to future leaders,wielding political power,stabbing in the back,writing rock songs,writing political tracts,promoting new technologies,collecting treasures
Brittaney Le, 20000301, DS, leading revolts,burping,promoting diversity,drinking one's life away,smoking Silk Cut cigarettes,creating nightmares,punishing criminals,drinking demon blood,solving crimes,saving money
Percy Walker, 20000465, CS, promoting conservative values,playing baseball,writing pop songs,coining sparkling witticisms,coining epigrams,making modern art,making cartoons,enriching uranium,promoting pop music,collecting rock samples
Nicholas Peterson, 20000051, DS, pursuing criminals,solving crimes,running a media empire,reading the news,promoting socialism,reading self-help books,spreading Christianity,performing Web searches,pulling dirty political tricks,eluding imperial storm-troopers
Kisha Mowery, 20000268, CS, promoting communism,testing new technologies,making unauthorized sex tapes,running a media empire,fighting with swords,running a smuggling business,ranting about liberals,leading armies into battle,writing rap songs,eluding authorities
Anthony Phan, 20000354, CS, chain-smoking Gauloises Bleues,running a fast-food business,making modern art,avoiding taxes,promoting new technologies,writing pop songs,fighting for democracy,promoting conservative values,singing pop songs,promoting pop music
Bobbie Reyes, 20000488, CS, writing modern fiction,starring in Hollywood movies,starring in comedies,singing pop songs,cursing at kitchen staff,collecting treasures,directing bad movies,playing the banjo,developing new technologies ,making modern art
Krystin Camp, 20000231, CS, promoting pacifism,teaching the next generation,chain-smoking Gauloises Bleues,amassing nuclear weapons,tolerating adultery,taking anabolic steroids,writing Hollywood movies,running Ponzi schemes,running a criminal enterprise,promoting humanism
Claudie Hahn, 20000286, CS, making political gaffes,wielding political power,womanizing,making vulgar jokes,running assembly lines,searching for the messiah,coining epigrams,leading revolts,hosting automotive shows,amassing nuclear weapons
Lorine Linkous, 20000334, CS, writing modern fiction,wielding political power,taking anabolic steroids,starring in Hollywood movies,test-driving cars,running a media empire,hiding from the public,promoting democracy,campaigning for social causes,selling franchises
Cindy Ruiz, 20000479, CS, staring at the moon,writing on wax tablets,writing pop songs,promoting Scientology,promoting Catholic values,collecting treasures,ranting about liberals,fighting with swords,scandalizing polite society,selling kitsch
Lela Garza, 20000466, DS, hunting monsters,meddling in the dark arts,smoking cigarettes,devising evil schemes,chasing after women,promoting conservative values,reporting the news,promoting charity,convicting criminals,finding clues
Stacee Barth, 20000324, DS, finding clues,reading minds,defending the weak,promoting tolerance,rescuing prisoners of war,duelling acrobatically,preventing crime,killing rival gladiators,impersonating women,pioneering new technologies
Alison Sharp, 20000194, DS, running for governor,preventing crime,eluding imperial storm-troopers,smoking cigarettes,gadding about town,promoting pop music,causing mayhem,duelling acrobatically,burping,going on commando missions
Chester Morales, 20000125, CS, publishing newspapers,wielding political power,selling franchises,writing pop songs,chasing after women,running an empire,building airplanes,making political gaffes,singing country music,running a media empire
Evelyn Gonzalez, 20000099, DS, interviewing politicians,pursuing criminals,preventing crime,fighting for justice,commanding a spaceship,selling franchises,extracting confessions,rooting out facts,building an army,diagnosing diseases
Denise Campbell, 20000010, CS, selling modern art,running a kingdom,staring at the moon,promoting conservative values,singing country music,tolerating adultery,singing pop songs,promoting movie violence,running a media empire,drawing whimsical cartoons
Louis Torres, 20000097, DS, finding clues,practicing the Occult,duelling acrobatically,searching for a new world,tracking down criminals,performing office chores,promoting tolerance,smoking cigarettes,solving mysteries,arresting criminals 
Flora Pittman, 20000486, DS, running a kingdom,devising evil schemes,starring in Hollywood movies,solving mysteries,wielding political power,punishing terrorists,performing magic tricks,singing pop songs,singing bawdy songs,promoting hair products
Ellyn Towns, 20000326, CS, interviewing celebrities,expressing dissent,collecting treasures,avoiding taxes,wielding political power,writing pop songs,running a kingdom,promoting circus attractions,going for a spacewalk,chain-smoking Gauloises Bleues
Thelma Burton, 20000494, CS, promoting liberalism,singing pop songs,writing pop songs,writing plays,collecting rock samples,staring at the moon,promoting Catholic values,running a media empire,running an empire,writing modern fiction
Julia Smith, 20000017, CS, amassing nuclear weapons,singing jazz songs,writing for the New Yorker,promoting Catholic values,preaching to presidents,grilling interviewees,singing pop songs,studying science,spreading political gossip,making cartoons
Mitchell Murphy, 20000483, CS, writing pop songs,wielding political power,building a search engine,avoiding taxes,test-driving cars,interviewing politicians,singing the blues,proving math theorems,writing Hollywood movies,issuing threats
Marcellus Upton, 20000264, CS, writing political tracts,promoting conservative values,singing pop songs,cross-dressing in women's clothes,solving mysteries,selling out,directing bad movies,playing the banjo,proving math theorems,popping amphetamines
Johanna Jordan, 20000192, DS, fighting for democracy,selling franchises,promoting tolerance,tracking down criminals,rooting out facts,finding clues,solving crimes,promoting hair products,hunting demons,killing rival gladiators
Victor Carter, 20000027, CS, coining sparkling witticisms,hiding from the public,singing pop songs,hosting automotive shows,writing romantic poetry,preventing crime,exploring the new world,promoting communism,fighting for civil rights,manipulating ingenues
Chantay Dickinson, 20000230, DS, fighting in gladiator arenas,practicing the Occult,inventing electrical marvels,rescuing prisoners of war,preventing crime,fighting for justice,chasing murderers,pioneering new technologies,making insipid musicals,finding clues
Jimmy Klein, 20000426, DS, hunting monsters,performing Web searches,living amongst apes,rescuing prisoners of war,promoting conservative values,finding clues,running a school for gifted teens,promoting humanism,making vulgar jokes,chasing terrorists
Jeremiah Williamson, 20000133, DS, writing plays,extracting confessions,solving mysteries,keeping accounts,solving crimes,promoting diversity,duelling acrobatically,burping,handing out flowers,singing bawdy songs
Jose Washington, 20000037, DS, reading minds,running a hardware company,standing up to bullies,fighting for the resistance,maintaining a secret identity,treating diseases,interviewing politicians,extracting confessions,solving crimes,preventing crime
Tracy Jennings, 20000472, CS, hosting automotive shows,starring in comedies,selling franchises,amassing nuclear weapons,writing rock songs,patenting new technologies ,selling fast food,running a kingdom,starring in Hollywood movies,searching for the messiah
Louise Martin, 20000054, CS, running a frontier town,challenging artistic norms,spreading revolution,making cartoons,ranting about liberals,playing jazz trumpet,selling out,running an empire,developing new technologies ,directing bad movies
Melody Owens, 20000442, DS, solving mysteries,gadding about town,making vulgar jokes,tracking down criminals,fighting for democracy,promoting diversity,killing teenagers,commanding a spaceship,hunting monsters,interpreting evidence
Lashon Stiles, 20000295, DS, studying magic,commanding a spaceship,stealing human fat,hacking into computers,maintaining a secret identity,practicing insincerity,solving crimes,singing bawdy songs,running a software company,wielding political power
Linda Garner, 20000145, DS, solving crimes,singing pop songs,interviewing celebrities,pursuing criminals,smoking Silk Cut cigarettes,promoting socialism,running a software company,finding clues,seducing young women,promoting capitalism
Willette Rudd, 20000323, DS, promoting conservative values,promoting tolerance,composing advertizing jingles,playing rock guitar,maintaining a secret identity,playing quidditch,surviving large-scale floods,teaching young mutants,ruling over subjects,arresting criminals 
Amiee Thacker, 20000212, CS, writing rock songs,making vulgar jokes,scandalizing polite society,promoting Kaballah,puncturing artistic sensibilities,preventing crime,writing for the New Yorker,ruling over subjects,ranting about liberals,campaigning for the presidency
Earlean Capps, 20000389, DS, causing mayhem,pursuing criminals,stealing human fat,promoting conservative values,tracking down criminals,reporting the news,standing up to bullies,arresting criminals,killing rival gladiators,chasing murderers
