Elroy Miner, 20000253, CS, promoting democracy,promoting vegetarianism,singing parody songs,drawing whimsical cartoons,avoiding taxes,making vulgar jokes,singing rock songs,starring in romantic comedies,making billions,winning heavyweight titles
Amiee Thacker, 20000212, DS, playing rock piano,promoting yellow journalism,promoting mysticism,foiling the schemes of evil villains,losing weight,reading the news,defending the innocent,laughing maniacally,chasing terrorists,solving crimes
Lela Garza, 20000466, CS, cross-dressing in women's clothes,promoting open-source software,promoting new technologies,writing pop songs,making political gaffes,promoting political causes,crooning love songs,expressing dissent,singing pop songs,making mediocre movies
Corina Dorman, 20000252, DS, solving crimes,killing monsters,running a criminal empire,pioneering new technologies,writing bad movies,fighting in gladiator arenas,writing up case notes,fighting barbarian hordes,hacking into corporate mainframes,deep-frying chicken
Kattie Fountain, 20000266, CS, piloting a spaceship,writing cook books,organizing a putsch,selling out,singing rock songs,doing slapstick comedy,building airplanes,playing soccer,leading armies into battle,singing country music
Elias Matthews, 20000116, CS, making cartoons,amassing weapons,test-driving cars,writing plays,terrorizing employees,drawing whimsical cartoons,singing pop songs,winning tennis tournaments,staring at the moon,wielding political power
Kelly Johnston, 20000456, DS, wooing potential brides,promoting American values,interpreting evidence,manipulating political pawns,collecting green Kryponite,piloting a spaceship,promoting pacifism,tolerating adultery,solving mysteries,slashing victims
Lou Koch, 20000207, CS, crooning love songs,spreading philosophy,starring in Hollywood movies,writing romantic poetry,running a new-age website,playing basketball,writing polemics,ranting about liberals,running a technology company,extracting confessions
Diana Baker, 20000004, DS, making cartoons,slashing victims,creating annoying rules,preventing crime,hunting demons,swinging from tree to tree,solving crimes,eating carrots,spreading Christianity,promoting capitalism
Virginia Moody, 20000435, DS, nursing a messiah complex,preventing crime,spreading Christianity,studying science,breaking bones,pioneering new technologies,slashing victims,hunting monsters,offering medical opinions,revelling in blood spatter
May Vega, 20000444, CS, suppressing minorities,running a media empire,playing rock piano,running a technology company,campaigning for social causes,campaigning for the presidency,womanizing,writing romantic poetry,singing pop songs,managing large development projects
Michael Long, 20000085, CS, singing pop songs,plotting mutinies,ranting about liberals,leaking information,promoting Catholic values,studying science,fighting for democracy,promoting Darwinism,expressing dissent,collecting treasures
Marcellus Upton, 20000264, CS, promoting communism,bridging cultures ,selling franchises,directing movies,promoting democracy,singing pop songs,scandalizing polite society,singing parody songs,winning heavyweight titles,ranting about religion
Genevieve Rowe, 20000101, CS, fighting for civil rights,constructing an ironic public image,fighting for democracy,starring in Hollywood movies,avoiding taxes,scandalizing polite society,cracking enemy codes,eluding authorities,ruining an empire,playing basketball
Tara Snyder, 20000134, DS, climbing social ladders,defending the weak,running a school for gifted teens,promoting science,duelling acrobatically,promoting logical thinking,protecting criminals,counting calories,performing kung-fu moves,making cartoons
Clint Fitzgerald, 20000121, DS, slashing victims,solving crimes,writing plays,eating census takers,campaigning for social causes,interpreting evidence,tolerating adultery,making money,extracting confessions,foiling the schemes of evil villains
Gail Mclaughlin, 20000109, CS, running a technology company,building houses for poor people,recording pop songs,singing rock songs,promoting political causes,warning about totalitarianism,ranting about liberals,developing new technologies ,promoting Catholic values,developing cunning plans
Adam Lee, 20000071, DS, campaigning for social causes,devising evil schemes,developing military strategies,manipulating political pawns,slashing victims,smoking cigarettes,rescuing damsels in distress,interpreting evidence,piloting a spaceship,performing magic tricks
Alesha Headley, 20000397, DS, playing rock piano,killing monsters,representing criminals,lying badly,promoting yellow journalism,fighting for the resistance,singing pop songs,arranging dinner parties,chasing criminals,selling confectionary
Irene Bryant, 20000034, DS, solving mysteries,arranging dinner parties,writing plays,climbing social ladders,tossing coins,killing monsters,going for a spacewalk,hunting monsters,collecting comic books,manipulating political pawns
Conchita Creamer, 20000232, CS, delivering forehand slams,crooning love songs,spreading philosophy,cross-dressing in women's clothes,promoting Catholic values,making lewd remarks,making vulgar jokes,leading revolts,commanding a spaceship,selling fast food
William Rodgers, 20000404, DS, killing rival gladiators,ranting about religion,winning heavyweight titles,winning tennis tournaments,climbing social ladders,offering legal advice,gossiping with galpals,collecting comic books,manipulating political pawns,counting calories
Pamala Riddle, 20000363, DS, performing kung-fu moves,punishing criminals,fighting the forces of good,killing rival gladiators,planting daffodils,spreading philosophy,running a school for gifted teens,tracking down criminals,fighting for justice,writing up case notes
Brittaney Steward, 20000292, CS, selling fast food,running a kingdom,singing jazz songs,devising evil schemes,starring in action movies,conducting illicit affairs,starring in Hollywood movies,promoting liberal values,performing household chores,chasing after women
Serina Earle, 20000359, CS, amassing nuclear weapons,knocking out opponents,promoting Catholic values,doing diet commercials,cursing at kitchen staff,enriching uranium,recruiting dissidents,starring in indy movies,interviewing politicians,womanizing
Yelena Ratliff, 20000282, DS, promoting science,interviewing politicians,seducing women,killing demons,undermining authority,preventing crime,promoting greed,promoting the Dark Side,counting calories,hunting monsters
Kathy Jacobs, 20000135, CS, going for a spacewalk,crooning love songs,keeping a diary,promoting open-source software,singing pop songs,getting plastic surgery,ranting about liberals,winning boxing matches,promoting Darwinism,piloting a spaceship
Ernie Post, 20000233, CS, writing plays,fighting for democracy,running a hardware company,promoting Darwinism,writing scripts,leading armies into battle,staring at the moon,writing pop songs,worrying about health,making science fiction movies
Marilyn King, 20000088, DS, duelling acrobatically,defending the innocent,hunting demons,counting calories,chasing criminals,creating an axis of evil,manipulating political pawns,smoking Laramie Hi-Tars,hunting monsters,climbing social ladders
Kathleen Fields, 20000469, CS, writing pop songs,making political gaffes,directing Hollywood movies,making lewd remarks,singing pop songs,seducing women,doing stand-up,selling out,drawing whimsical cartoons,winning boxing matches
Leora Pyle, 20000356, DS, reporting the news,solving crimes,extracting confessions,pioneering new technologies,running a school for gifted teens,making money,reading the news,foiling the schemes of evil villains,killing demons,singing pop songs
Frederic Crook, 20000209, CS, promoting socialism,playing rock piano,making bad movies,going for a spacewalk,dating centrefolds,organizing a putsch,directing Hollywood movies,developing open-source software,recruiting dissidents,making antisemitic remarks
Jim Bailey, 20000172, DS, exorcising demons,foiling the schemes of evil villains,writing cook books,terrorizing sleepers,preaching tolerance,duelling acrobatically,collecting comic books,killing monsters,offering legal advice,reading the news
Judith Wilson, 20000013, DS, tracking down terrorists,piloting a spaceship,promoting pacifism,promoting conservative values,smoking Silk Cut cigarettes,running a hardware company,solving crimes,extracting confessions,preventing crime,preaching tolerance
Rigoberto Zeller, 20000369, CS, making movies,writing plays,winning boxing matches,investing in real estate,promoting political causes,recording pop songs,marrying underage girls,mass-producing cars,composing classical music,chasing after women
Azalee Chavarria, 20000247, CS, insulting minorities,publishing newspapers,promoting racial harmony,promoting conservative values,writing novels,spreading philosophy,directing violent movies,building houses for poor people,singing the blues,studying linguistics
Yolanda Morales, 20000410, DS, singing pop songs,devising evil schemes,extracting confessions,chasing terrorists,revelling in blood spatter,maintaining salon-quality hair,seducing toy boys,collecting comic books,studying science,practicing the Occult
Sandi Merritt, 20000353, CS, promoting political causes,promoting vegetarianism,racking up marriages,plotting mutinies,drawing whimsical cartoons,staring at the moon,making political gaffes,writing pop songs,playing the trumpet,betraying friends
Julia Smith, 20000017, CS, investing money,changing sides,playing basketball,spreading philosophy,singing rock songs,cross-dressing in women's clothes,building airplanes,making political gaffes,recruiting dissidents,singing pop songs
Serina Earle, 20000359, CS, campaigning for social causes,spying for the enemy,making cartoons,promoting movie violence,studying science,leading revolts,winning heavyweight titles,instigating rebellion,wielding political power,marrying underage girls
Jimmie Gray, 20000167, DS, performing kung-fu moves,promoting capitalism,reading the news,rescuing damsels in distress,pioneering new technologies,laughing maniacally,solving crimes,being condescending to customers,clipping coupons,collecting comic books
Martin Phillips, 20000060, DS, causing mayhem,interviewing politicians,solving crimes,manipulating political pawns,eating bacon cheeseburgers,composing classical music,hunting monsters,winning heavyweight titles,creating nightmares,meddling in the dark arts
Justin White, 20000058, DS, promoting Catholic values,revelling in blood spatter,reporting the news,wanting to be a real person,making cartoons,interpreting evidence,leading revolts,spreading Christianity,fighting in gladiator arenas,cooking for friends
Melissa Alexander, 20000160, DS, tricking criminals,turning it up to 11,hunting monsters,attacking consumerism,causing mayhem,counting calories,arresting drug dealers,promoting Kaballah,killing teenagers,keeping a diary
Dave Hammond, 20000490, DS, interviewing politicians,developing military strategies,reporting the news,foiling the schemes of evil villains,promoting science,working for the forces of darkness,winning heavyweight titles,promoting enlightenment,drinking Duff beer,solving mysteries
Elias Matthews, 20000116, DS, solving mysteries,tricking criminals,lying badly,fighting for the resistance,smoking Laramie Hi-Tars,tossing coins,writing rap songs,hunting demons,solving crimes,singing pop songs
Tracy Holmes, 20000136, CS, fighting for democracy,womanizing,plotting mutinies,promoting conservative values,making billions,writing pop songs,enriching uranium,picking weird children names,designing computer systems,composing classical music
Charles Baker, 20000430, DS, fighting for civil rights,promoting logical thinking,counting calories,promoting science,making vulgar jokes,promoting yellow journalism,terrorizing employees,ruling over subjects,solving crimes, spreading revolution
Glennie Carnes, 20000367, CS, publishing newspapers,promoting racial harmony,arguing against capitalism,instigating rebellion,promoting socialism,making cartoons,promoting vegetarianism,climbing social ladders,writing novels,conducting illicit affairs
Jason Holloway, 20000118, CS, singing rock songs,winning Oscars,giving investment advice,singing pop songs,amassing wealth,seducing women,playing basketball,starring in Hollywood movies,chasing after women,doing stand-up
Morgan Libby, 20000288, DS, developing military strategies,stealing jewels,smoking cigarettes,promoting healthy eating,tending the garden,promoting mysticism,piloting a spaceship,fighting for justice,promoting yellow journalism,writing up case notes
Patsy Mckenzie, 20000162, CS, causing political scandals,fighting for worker's rights,promoting political causes,running a hardware company,womanizing,fighting for democracy,writing on wax tablets,pioneering new technologies,singing rock songs,bugging political rivals
Jeremiah Williamson, 20000133, CS, ranting about liberals,singing rock songs,suppressing minorities,promoting conservative values,keeping a diary,making mediocre movies,studying linguistics,marrying underage girls,investing money,promoting racial harmony
Phillip Brooks, 20000043, DS, reading the news,working for the forces of darkness,extracting confessions,causing mayhem,offering legal advice,killing demons,counting calories,nursing a messiah complex,developing military strategies,defending the weak
Lela Garza, 20000466, CS, fighting for democracy,developing military strategies,running a hardware company,promoting conservative values,singing rock songs,wielding political power,stabbing in the back,promoting racial harmony,developing real estate,postulating bizarre theories
Samuel Fields, 20000158, DS, hunting demons,smoking Silk Cut cigarettes,solving crimes,drinking Duff beer,selling comic books,interviewing celebrities,spreading Christianity,finding clues,breaking heads,fighting for the resistance
Tina Griffin, 20000138, DS, finding clues,analyzing murder scenes,promoting yellow journalism,duelling acrobatically,digging for antiquities,promoting pacifism,promoting logical thinking,running a software company,teaching magic,running a kingdom
Angel Graves, 20000431, DS, solving crimes,reading the news,fighting for the resistance,creating an axis of evil,selling chrystal meth,drinking too much red wine,manipulating political pawns,engaging in bare-knuckle fighting,fussing about cleanliness,undermining authority
Jacqueline Perez, 20000009, CS, enriching uranium,writing pop songs,promoting liberal values,selling out,promoting conservative values,making political gaffes,promoting socialism,performing household chores,studying linguistics,running a kingdom
Morgan Libby, 20000288, CS, developing real estate,winning tennis tournaments,directing Hollywood movies,knocking out opponents,winning boxing matches,ranting about liberals,studying computability,making political gaffes,solving mysteries,making billions
Joan Taylor, 20000083, DS, promoting greed,wisecracking,counting calories,spreading Christianity,writing bad movies,duelling acrobatically,campaigning for social causes,swinging from tree to tree,developing military strategies,stealing human fat
Jean Howard, 20000094, DS, rescuing damsels in distress,hunting demons,slashing victims,extracting confessions,smoking Laramie Hi-Tars,selling confectionary,solving mysteries,finding clues,seducing women,killing monsters
Sarah Curtis, 20000468, CS, mass-producing cars,making dumb comedies,instigating rebellion,singing pop songs,selling out,racking up marriages,fighting for democracy,studying science,bugging political rivals,solving crimes
William Rodgers, 20000404, CS, fighting for democracy,selling military secrets,promoting conservative values,selling out,writing Hollywood movies,writing polemics,finding clues,ruining an empire,investing money,directing movies
Kattie Fountain, 20000266, CS, writing novels,singing pop songs,promoting circus attractions,amassing wealth,writing bad movies,developing military strategies,cooking fancy food,making lewd remarks,popping Viagra,collecting rock samples
Beverlee Whited, 20000260, CS, dancing to disco music,constructing an ironic public image,campaigning for the presidency,creating an axis of evil,starring in Hollywood movies,fighting for democracy,promoting science,winning boxing matches,making political gaffes,investing in real estate
Seth Willis, 20000129, CS, singing pop songs,changing sides,amassing nuclear weapons,campaigning for world peace,investing money,writing polemics,playing soccer,teaching philosophy to future leaders,writing rap songs,worrying about health
Hsiu Mattos, 20000236, CS, leaking information,spying for the enemy,writing plays,building houses for poor people,worrying about health,promoting racial harmony,promoting Darwinism,playing camp villains,marrying underage girls,directing movies
Linda Garner, 20000145, CS, singing middle-of-the-road songs,writing comedy,postulating bizarre theories,selling comic books,winning heavyweight titles,playing the trumpet,campaigning for environmental causes,funding a cure for malaria,getting plastic surgery,directing violent movies
Flora Pittman, 20000486, DS, seducing women,running a software company,climbing social ladders,winning heavyweight titles,losing control,eating people,writing bad movies,killing demons,terrorizing sleepers,finding clues
Judy Nash, 20000411, CS, solving crimes,leading armies into battle,making movies,interviewing politicians,popping Viagra,writing for the New Yorker,making billions,singing pop songs,recruiting dissidents,studying linguistics
Marva Sheppard, 20000333, DS, hunting monsters,tossing coins,winning Michelin stars,launching hostile takeovers,singing rock songs,swinging from tree to tree,building an army,smoking Laramie Hi-Tars,running a kingdom,finding clues
Bobby Williams, 20000026, DS, killing demons,winning Michelin stars,knocking out opponents,tricking criminals,interpreting evidence,duelling acrobatically,bending the law,protecting criminals,solving crimes,running a software company
May Vega, 20000444, DS, running a software company,running a school for gifted teens,bending the law,promoting yellow journalism,planting daffodils,promoting enlightenment,duelling acrobatically,knocking out opponents,manipulating political pawns,living amongst apes
Adina Lim, 20000361, DS, selling confectionary,inventing electrical marvels,tricking criminals,swinging from tree to tree,clinging to past dreams,tossing coins,tracking down terrorists,arranging dinner parties,solving crimes,fighting for justice
Kaitlyn Bassett, 20000329, CS, selling out,podcasting about movies,starring in comedies,betraying friends,chasing after women,producing Hipbop records,promoting Darwinism,staring at the moon,playing rock piano,doing stand-up
Chantay Dickinson, 20000230, CS, going for a spacewalk,writing pop songs,launching a war,piloting a spaceship,playing soccer,betraying friends,promoting racial harmony,singing pop songs,driving under the influence,singing country music
Shawn Hall, 20000019, DS, meddling in the dark arts,preaching tolerance,tracking down terrorists,seeking revenge,solving crimes,tending the garden,foiling the schemes of evil villains,interviewing politicians,writing plays,exorcising demons
Isabel Warner, 20000449, DS, turning it up to 11,hunting monsters,lying badly,killing teenagers,pursuing criminals,working for the forces of darkness,selling comic books,winning Michelin stars,pioneering new technologies,solving crimes
Claretha Newberry, 20000304, CS, starring in comedies,promoting liberal values,producing Hipbop records,promoting racial harmony,amassing wealth,expressing dissent,writing scripts,opening a new front,wielding political power,singing pop songs
Ross Aguilar, 20000148, DS, spreading Christianity,wanting to be a real person,making money,tricking criminals,collecting comic books,leading revolts,reporting the news,foiling the schemes of evil villains,promoting the Dark Side,nursing a messiah complex
Lois Coleman, 20000090, DS, revelling in blood spatter,eating census takers,interpreting evidence,tossing coins,maintaining salon-quality hair,manipulating political pawns,hunting monsters,killing teenagers,promoting logical thinking,killing demons
Margarita Foster, 20000128, DS, running a school for gifted teens,smoking Laramie Hi-Tars,singing pop songs,fighting for justice,teaching magic,looking for hidden treasures,writing plays,preaching tolerance,launching hostile takeovers,running a fast-food business
Wayne Tucker, 20000484, DS, writing cook books,fighting for justice,killing demons,running a fast-food business,gadding about town,making vulgar jokes,bending the law,extracting confessions,tolerating adultery,solving crimes
Jerald Cruz, 20000497, CS, drawing whimsical cartoons,collecting treasures,starring in science fiction movies,composing classical music,playing soccer,modeling clothes,playing jazz trumpet,campaigning for the presidency,instigating rebellion,changing sides
Lela Garza, 20000466, CS, collecting treasures,winning Michelin stars,giving investment advice,directing comedies,suppressing minorities,starring in comedies,fighting with swords, fighting with swords,promoting conservative values,playing rock piano
Sanda Luther, 20000370, DS, stealing human fat,running a school for gifted teens,writing pop songs,climbing social ladders,losing weight,solving crimes,applying science,terrorizing sleepers,teaching magic,singing rock songs
Rossana Denton, 20000251, DS, promoting science,extracting confessions,writing plays,drinking demon blood,tempting fate,climbing social ladders,playing rock piano,pursuing criminals,promoting logical thinking,starring in sit-coms
Homer Wise, 20000199, CS, singing jazz songs,speaking with funny accents,leading armies into battle,modeling clothes,funding a cure for malaria,starring in romantic comedies,starring in Hollywood movies,promoting racial harmony,investing in real estate,over-acting
Kimberli Whatley, 20000396, CS, developing military strategies,making movies,playing rock piano,wielding political power,fighting for worker's rights,suppressing minorities,singing rock songs,writing romantic poetry,constructing an ironic public image,pioneering new technologies
Tami Black, 20000108, DS, promoting healthy eating,inventing electrical marvels,hunting demons,losing weight,interpreting evidence,killing teenagers,drinking Duff beer,reading the news,losing control,promoting science
Elliott Thorton, 20000305, CS, making fantasy movies,making antisemitic remarks,enriching uranium,seducing women,crushing dissent,playing James Bond,ranting about liberals,writing polemics,singing rock songs,fighting for democracy
Christine Walker, 20000005, CS, promoting pacifism,performing household chores,starring in Hollywood movies,scandalizing polite society,ranting about liberals,womanizing,leading armies into battle,instigating rebellion,funding a cure for malaria,trading innuendo
Louise Martin, 20000054, CS, eluding the public gaze,winning boxing matches,singing pop songs,promoting communism,studying science,getting plastic surgery,bridging cultures ,fighting for democracy,starring in Hollywood movies,leading armies into battle
Brett Haynes, 20000176, CS, doing stand-up,pioneering new technologies,telling politicians what to do,expressing dissent,studying linguistics,running a movie studio,starring in Hollywood movies,interviewing politicians,promoting racial harmony,building airplanes
Clair Kramer, 20000373, CS, starring in indy movies,directing Hollywood movies,spying for the enemy,betraying friends,delivering forehand slams,promoting Darwinism,winning heavyweight titles,popping Viagra,wielding political power,promoting open-source software
Louise Martin, 20000054, CS, promoting conservative values,singing Hipbop songs,singing pop songs,running a movie studio,crooning love songs,making billions,seducing women,starring in romantic comedies,knocking out opponents,starring in Hollywood movies
Aleisha Albright, 20000280, CS, teaching philosophy to future leaders,making dumb comedies,singing pop songs,cross-dressing in women's clothes,writing plays,playing camp villains,slashing victims,pioneering new technologies,performing household chores,wielding political power
Casey Chambers, 20000117, DS, gadding about town,driving under the influence,working with nuclear materials,planting daffodils,piloting a spaceship,reading the news,seducing women,collecting comic books,avoiding growing old,analyzing murder scenes
Charisse Duval, 20000203, DS, killing teenagers,singing rock songs,smoking Laramie Hi-Tars,promoting the Dark Side,maintaining a secret identity,collecting green Kryponite,tossing coins,climbing social ladders,solving mysteries,performing kung-fu moves
Samantha Ellis, 20000475, CS, winning heavyweight titles,fighting for civil rights,publishing soft pornography,directing comedies,singing rock songs,creating an axis of evil,promoting healthy eating,playing the trumpet,playing basketball,marrying underage girls
Carol Patterson, 20000059, DS, finding clues,composing classical music,wanting to be a real person,seducing women,hunting monsters,tossing coins,running a school for gifted teens,collecting comic books,cooking for friends,practicing the Occult
Solomon Mccallum, 20000357, DS, seducing toy boys,attacking consumerism,drinking one's life away,frowning at errant husbands,drinking Duff beer,interpreting evidence,clinging to past dreams,devising evil schemes,engaging in bare-knuckle fighting,fighting the forces of good
Gregory Cook, 20000052, DS, solving crimes,interpreting evidence,studying science,climbing social ladders,selling confectionary,maintaining salon-quality hair,foiling the schemes of evil villains,duelling acrobatically,hunting demons,stealing human fat
