Troy Jensen, 20000143, CS, selling cosmetics,promoting conservative values,leading armies into battle,singing country music,worrying about health,solving crimes,starring in comedies,developing new technologies ,singing parody songs,writing pop songs
Annis Bourque, 20000337, DS, piloting a spaceship,rescuing damsels in distress,promoting conservative values,promoting pacifism,climbing social ladders,offering legal advice,interviewing celebrities,promoting capitalism,defending the innocent,tempting fate
Ross Aguilar, 20000148, CS, attacking neighbors,directing movies,ranting about liberals,directing comedies,directing animated films,starring in comedies,delivering forehand slams,fighting for democracy,studying science,making political gaffes
Roselyn Schott, 20000331, CS, interviewing celebrities,test-driving cars,promoting vegetarianism,postulating bizarre theories,ranting about liberals,solving mysteries,starring in Hollywood movies,seducing women,singing pop songs,getting plastic surgery
Barbara Perkins, 20000454, CS, fighting for civil rights,promoting new technologies,bridging cultures ,writing novels,getting plastic surgery,writing bad movies,teaching philosophy to future leaders,cursing at kitchen staff,leading armies into battle,promoting communism
Jacqueline Perez, 20000009, DS, promoting science,terrorizing sleepers,playing rock piano,clinging to past dreams,applying science,solving crimes,going for a spacewalk,promoting logical thinking,causing mayhem,cooking for friends
Marcella Daniel, 20000448, CS, collecting treasures,singing Hipbop songs,winning heavyweight titles,racking up marriages,teaching philosophy to future leaders,singing pop songs,dating centrefolds,playing basketball,leading armies into battle,currying favour
Candice Jimenez, 20000115, CS, opening a new front,developing open-source software,attacking neighbors,cross-dressing in women's clothes,working in a freak show,campaigning for world peace,running a hardware company,studying linguistics,winning heavyweight titles,making political gaffes
Roberto Baker, 20000168, CS, making dumb comedies,managing hedge funds,promoting movie violence,promoting democracy,amassing wealth,ranting about liberals,promoting conservative values,selling tickets,leading revolts,producing Hipbop records
Brittaney Le, 20000301, DS, running for governor,causing mayhem,seducing women,killing teenagers,performing kung-fu moves,wisecracking,living amongst apes,hunting monsters,finding clues,solving crimes
Bill Chavez, 20000408, DS, pioneering new technologies,solving crimes,chasing criminals,smoking Laramie Hi-Tars,smoking Silk Cut cigarettes,clipping coupons,tending the garden,running a kingdom,turning it up to 11,eating census takers
Elizabeth Lopez, 20000064, CS, writing plays,singing pop songs,making political gaffes,writing scripts,making antisemitic remarks,building houses for poor people,publishing soft pornography,developing real estate,promoting open-source software,interviewing celebrities
Sophie Stokes, 20000428, CS, spreading philosophy,promoting healthy eating,delivering forehand slams,making science fiction movies,marrying underage girls,singing pop songs,studying linguistics,keeping a diary,starring in sit-coms,designing computer systems
Marian Jennings, 20000120, CS, ranting about liberals,winning heavyweight titles,singing pop songs,studying linguistics,making mediocre movies,amassing weapons,commanding a spaceship,constructing an ironic public image,drawing whimsical cartoons,recruiting dissidents
Lou Koch, 20000207, DS, solving crimes,promoting science,making movies,attacking consumerism,performing kung-fu moves,climbing social ladders,killing teenagers,commanding Roman legions,gadding about town,working for the forces of darkness
Domingo Greer, 20000165, DS, reporting the news,making chocolate,fighting for justice,clipping coupons,stealing human fat,fighting in gladiator arenas,playing rock piano,running a school for gifted teens,solving mysteries,womanizing
Jeri Etheridge, 20000296, CS, singing country music,womanizing,staring at the moon,writing scripts,singing rock songs,promoting circus attractions,leading armies into battle,recruiting dissidents,winning Michelin stars,interviewing politicians
Ross Aguilar, 20000148, CS, popping Viagra,singing rock songs,postulating bizarre theories,fighting for worker's rights,cooking fancy food,ranting about liberals,leading armies into battle,playing basketball,singing country music,singing pop songs
Elisa Schmidt, 20000436, DS, creating annoying rules,promoting the Dark Side,representing criminals,fighting the forces of good,tempting fate,winning Michelin stars,manipulating political pawns,preening in front of the mirror,solving mysteries,smoking Laramie Hi-Tars
Roberto Baker, 20000168, CS, wielding political power,writing rock songs,singing parody songs,plotting mutinies,promoting political causes,devising evil schemes,winning Michelin stars,selling franchises,crooning love songs,designing computer systems
Lori Shelton, 20000189, DS, wooing potential brides,wanting to be a real person,hunting monsters,seducing toy boys,devising evil schemes,losing weight,writing cook books,running a hardware company,promoting yellow journalism,keeping a diary
Rachel Nelson, 20000087, CS, winning heavyweight titles,changing sides,getting plastic surgery,singing pop songs,composing classical music,promoting political causes,building airplanes,leading armies into battle,enriching uranium,promoting circus attractions
Bernard Townsend, 20000417, CS, promoting conservative values,running a movie studio,promoting communism,fighting with swords,promoting vegetarianism,staring at the moon,searching for a new world,singing parody songs,studying science,over-acting
Ann Mack, 20000123, DS, running for governor,manipulating political pawns,revelling in blood spatter,tricking criminals,killing monsters,terrorizing sleepers,seducing women,hunting demons,undermining authority,defending the weak
Thomas Tyler, 20000413, CS, singing pop songs,promoting vegetarianism,ruining an empire,climbing social ladders,developing military strategies,making vulgar jokes,fighting for democracy,amassing weapons,singing rock songs,fomenting social revolution
Julio Fernandez, 20000107, CS, terrorizing prostitutes,crooning love songs,picking weird children names,winning heavyweight titles,seducing women,performing serious acting,winning tennis tournaments,making science fiction movies,publishing newspapers,test-driving cars
Debi Lange, 20000381, CS, plotting mutinies,driving under the influence,attacking neighbors,writing plays,singing pop songs,doing stand-up,fomenting social revolution,amassing wealth,winning tennis tournaments,making mediocre movies
Sherie Lerner, 20000259, DS, writing pop songs,fighting for justice,bending the law,offering legal advice,tossing coins,eating carrots,hunting monsters,writing plays,gadding about town,promoting the Dark Side
Dusti Harwood, 20000327, CS, running a media empire,promoting Catholic values,enriching uranium,cursing at kitchen staff,constructing an ironic public image,seducing women,making science fiction movies,promoting vegetarianism,designing computer systems,campaigning for social causes
Patricia Alexander, 20000011, DS, preparing for war,drinking demon blood,frowning at errant husbands,running a software company,making movies,foiling the schemes of evil villains,singing pop songs,hunting demons,cooking for friends,preventing crime
Johanna Jordan, 20000192, CS, starring in romantic comedies,searching for a new world,seducing women,promoting conservative values,writing plays,writing pop songs,singing pop songs,doing stand-up,mass-producing cars,funding a cure for malaria
Julie Ward, 20000077, DS, promoting the Dark Side,tolerating adultery,hunting demons,killing demons,applying science,preventing crime,inventing electrical marvels,working for the forces of darkness,extracting confessions,defending the innocent
Dominica Otero, 20000206, CS, developing open-source software,leading revolts,designing computer systems,bugging political rivals,recruiting dissidents,ranting about liberals,making bad movies,singing pop songs,extracting confessions,enjoying salsa dancing
Catherine Hernandez, 20000069, DS, hunting demons,killing demons,analyzing murder scenes,selling comic books,interpreting evidence,knocking out opponents,stabbing in the back,attacking consumerism,losing weight,devising evil schemes
Norma Price, 20000080, CS, promoting conservative values,promoting healthy eating,writing scripts,running theme parks,spying for the enemy,hosting automotive shows,managing large development projects,making movies,crooning love songs,suppressing minorities
Duane Sims, 20000166, DS, fighting the forces of good,undermining authority,rescuing damsels in distress,extracting confessions,driving under the influence,writing bad movies,meddling in the dark arts,promoting the Dark Side,defending the innocent,interpreting evidence
Patricia Alexander, 20000011, CS, running a hardware company,selling fast food,writing pop songs,running a movie studio,making antisemitic remarks,recruiting dissidents,promoting conservative values,wielding political power,starring in comedies,instigating rebellion
Pamala Riddle, 20000363, DS, foiling the schemes of evil villains,pulling pranks,smoking Laramie Hi-Tars,promoting the Dark Side,working for the forces of darkness,promoting yellow journalism,pursuing criminals,manipulating political pawns,losing weight,hunting demons
Sherie Lerner, 20000259, DS, running a school for gifted teens,hunting monsters,finding clues,driving under the influence,singing rock songs,fussing about cleanliness,avoiding work,foiling the schemes of evil villains,eating census takers,working for the forces of darkness
Kirby Broome, 20000332, CS, amassing wealth,doing stand-up,postulating bizarre theories,constructing an ironic public image,winning tennis tournaments,extracting confessions,knocking out opponents,singing parody songs,amassing weapons,leading armies into battle
Patsy Mckenzie, 20000162, CS, terrorizing prostitutes,making science fiction movies,composing classical music,ruling over subjects,promoting new technologies,working in a freak show,running a kingdom,betraying friends,slashing victims,starring in Hollywood movies
Gregory Cook, 20000052, CS, promoting democracy,staring at the moon,spreading revolution,suppressing minorities,promoting racial harmony,bridging cultures ,writing on wax tablets,winning heavyweight titles,changing sides,singing rock songs
Maxima Talley, 20000249, DS, promoting the Dark Side,making vulgar jokes,devising evil schemes,solving mysteries,climbing social ladders,losing control,promoting yellow journalism,writing plays,duelling acrobatically,driving under the influence
Pennie Melvin, 20000205, CS, making science fiction movies,driving under the influence,directing comedies,promoting conservative values,writing for the New Yorker,promoting circus attractions,extracting confessions,promoting Darwinism,doing stand-up,writing scripts
Barbara Perkins, 20000454, DS, defending the weak,extracting confessions,promoting greed,applying science,pioneering new technologies,making movies,climbing social ladders,causing mayhem,cross-dressing in women's clothes,solving crimes
Dan Pope, 20000174, CS, promoting communism,spreading philosophy,promoting healthy eating,getting plastic surgery,winning tennis tournaments,opening a new front,writing pop songs,cross-dressing in women's clothes,making fantasy movies,making political gaffes
Romelia Holden, 20000312, DS, pursuing criminals,saving money,killing monsters,spreading Christianity,collecting green Kryponite,stealing human fat,wanting to be a real person,preventing crime,seducing women,fighting the forces of good
Lien Halverson, 20000392, DS, hunting monsters,solving crimes,foiling the schemes of evil villains,exorcising demons,living amongst apes,promoting logical thinking,preventing crime,selling chrystal meth,writing pop songs,working for the forces of darkness
Terry Flores, 20000055, CS, fighting for worker's rights,postulating bizarre theories,speaking with funny accents,leading armies into battle,starring in comedies,directing comedies,knocking out opponents,popping Viagra,building houses for poor people,wielding political power
Cindy Ruiz, 20000479, CS, singing rock songs,postulating bizarre theories,writing pop songs,playing the trumpet,amassing wealth,directing movies,seducing women,singing pop songs,womanizing,making political gaffes
Roberto Baker, 20000168, CS, modeling clothes,dating centrefolds,keeping a diary,fighting for civil rights,stabbing in the back,winning heavyweight titles,bridging cultures ,studying linguistics,developing new technologies ,betraying friends
Gabriel Webster, 20000161, DS, studying science,planting daffodils,tracking down criminals,promoting Kaballah,living amongst apes,promoting conservative values,killing teenagers,duelling acrobatically,rescuing damsels in distress,preaching tolerance
Jeri Etheridge, 20000296, DS, killing monsters,promoting pacifism,foiling the schemes of evil villains,duelling acrobatically,making cartoons,slashing victims,drinking Duff beer,tricking criminals,singing pop songs,tracking down terrorists
Samantha Ellis, 20000475, CS, organizing a putsch,ranting about liberals,promoting pacifism,doing diet commercials,selling fast food,developing cunning plans,postulating bizarre theories,knocking out opponents,driving under the influence,winning Michelin stars
Gloria Vargas, 20000495, DS, singing pop songs,foiling the schemes of evil villains,stealing jewels,fighting the forces of good,spreading philosophy,interpreting evidence,playing rock piano,duelling acrobatically,convicting criminals,smoking Silk Cut cigarettes
Charles Briggs, 20000159, DS, communicating with animals,developing military strategies,counting calories,promoting enlightenment,extracting confessions,promoting science,hunting demons,duelling acrobatically,interpreting evidence,being condescending to customers
Leigh Morris, 20000191, CS, singing pop songs,recording pop songs,singing country music,writing plays,investing money,starring in romantic comedies,telling politicians what to do,making billions,knocking out opponents,promoting conservative values
Cathern Mclain, 20000313, DS, lying badly,making money,interviewing celebrities,solving mysteries,promoting logical thinking,fighting for civil rights,arranging dinner parties,working for the forces of darkness,counting calories,hunting monsters
Dreama Jernigan, 20000283, DS, interpreting evidence,arranging dinner parties,writing bad movies,preventing crime,bending the law,inventing electrical marvels,solving crimes,killing teenagers,launching hostile takeovers,applying science
Sixta Boling, 20000277, DS, eating carrots,collecting green Kryponite,promoting greed,tracking down criminals,manipulating political pawns,chasing terrorists,promoting capitalism,pioneering new technologies,promoting pacifism,hunting monsters
Walter Jenkins, 20000045, CS, solving mysteries,searching for a new world,launching a war,singing pop songs,scandalizing polite society,campaigning for the presidency,climbing social ladders,speaking with funny accents,designing computer systems,collecting rock samples
Dusti Harwood, 20000327, CS, dating centrefolds,ranting about religion,teaching philosophy to future leaders,crooning love songs,flaunting foppish fashions,running a hardware company,playing rock piano,test-driving cars,changing sides,preaching to presidents
Evangeline Benitez, 20000276, DS, running a kingdom,preaching tolerance,foiling the schemes of evil villains,solving crimes,promoting logical thinking,clinging to past dreams,singing pop songs,killing teenagers,protecting criminals,seducing women
Rachel Nelson, 20000087, DS, playing rock piano,making money,preventing crime,pursuing criminals,promoting enlightenment,reporting the news,promoting capitalism,devising evil schemes,foiling the schemes of evil villains,punishing criminals
Stacey Roy, 20000137, CS, solving crimes,promoting healthy eating,wielding political power,fighting for democracy,singing Hipbop songs,writing plays,promoting Catholic values,singing country music,searching for the messiah,promoting open-source software
Daniel Hill, 20000048, CS, delivering forehand slams,chasing after women,organizing a putsch,mass-producing cars,winning boxing matches,performing household chores,hiding from the public,staring at the moon,designing computer systems,singing pop songs
Christopher Foster, 20000084, CS, singing pop songs,crooning love songs,currying favour,piquing public interest,promoting communism,writing on wax tablets,directing movies,studying science,starring in comedies,running a technology company
Anna Smith, 20000100, DS, fussing about cleanliness,inventing electrical marvels,digging for antiquities,writing about sex,playing rock piano,interviewing celebrities,knocking out opponents,hunting demons,causing mayhem,extracting confessions
Melissa Alexander, 20000160, CS, extracting confessions,cross-dressing in women's clothes,playing rock piano,campaigning for the presidency,designing computer systems,ranting about religion,spying for the enemy,delivering forehand slams,promoting liberal values,starring in comedies
Elliott Thorton, 20000305, CS, making mediocre movies,ranting about liberals,promoting democracy,playing soccer,managing hedge funds,winning tennis tournaments,writing romantic poetry,running a kingdom,campaigning for social causes,terrorizing prostitutes
Deborah Adkins, 20000463, CS, singing pop songs,writing plays,playing rock piano,playing the trumpet,running a media empire,ranting about religion,winning tennis tournaments,cracking enemy codes,wielding political power,starring in Hollywood movies
Azalee Chavarria, 20000247, DS, counting calories,smoking Laramie Hi-Tars,duelling acrobatically,devising evil schemes,developing military strategies,manipulating political pawns,seducing women,wielding political power,promoting greed,hunting monsters
Larry Henning, 20000339, DS, promoting capitalism,promoting healthy eating,inventing electrical marvels,hunting monsters,wanting to be a real person,slashing victims,seducing women,maintaining salon-quality hair,promoting pacifism,tracking down criminals
Val Zuniga, 20000342, DS, running a school for gifted teens,clinging to past dreams,battling the forces of darkness,exorcising demons,reporting the news,fighting for civil rights,slashing victims,piloting a spaceship,preventing crime,fighting the forces of good
Cyndi Vance, 20000239, CS, making cartoons,fighting for democracy,changing sides,attacking neighbors,winning boxing matches,developing cunning plans,making billions,singing country music,studying science,telling politicians what to do
Jade Arthur, 20000215, CS, promoting conservative values,ruining an empire,studying linguistics,spreading philosophy,betraying friends,singing pop songs,spying for the enemy,winning tennis tournaments,developing military strategies,working in a freak show
Shery Nieto, 20000298, CS, campaigning for environmental causes,terrorizing employees,cross-dressing in women's clothes,postulating bizarre theories,eluding the public gaze,making dumb comedies,developing real estate,producing Hipbop records,staring at the moon,getting plastic surgery
Ericka Selby, 20000388, CS, fighting for democracy,running for the senate,promoting communism,amassing wealth,leading armies into battle,pioneering new technologies,singing rock songs,eluding capture,spreading philosophy,winning heavyweight titles
Dan Pope, 20000174, DS, duelling acrobatically,tossing coins,engaging in bare-knuckle fighting,counting calories,gadding about town,knocking out opponents,manipulating political pawns,pinching pennies,hunting demons,chasing terrorists
Shelia Zimmerman, 20000141, DS, gadding about town,smoking Silk Cut cigarettes,winning heavyweight titles,clinging to past dreams,preparing for war,developing military strategies,writing bad movies,wielding political power,fighting for justice,promoting greed
Kirby Broome, 20000332, DS, campaigning for social causes,piloting a spaceship,attacking consumerism,wisecracking,chasing terrorists,stealing human fat,starring in sit-coms,promoting capitalism,interpreting evidence,analyzing murder scenes
Ricky Parker, 20000127, DS, maintaining a secret identity,spreading Christianity,lying badly,posing as a street thug,hunting demons,promoting yellow journalism,killing teenagers,teaching magic,making movies,avenging loved ones
Isabel Warner, 20000449, CS, campaigning for world peace,promoting conservative values,singing parody songs,building houses for poor people,drawing whimsical cartoons,investing money,writing plays,ranting about liberals,writing bad movies,driving under the influence
Rossana Denton, 20000251, CS, campaigning for social causes,stabbing in the back,selling tickets,writing bad movies,amassing wealth,promoting conservative values,writing plays,running a fast-food business,instigating rebellion,singing jazz songs
Gilbert Hansen, 20000462, CS, currying favour,attacking neighbors,making mediocre movies,frowning at errant husbands,spreading revolution,starring in Hollywood movies,starring in comedies,fighting with swords,collecting treasures,promoting circus attractions
Gilbert Hansen, 20000462, DS, foiling the schemes of evil villains,manipulating political pawns,interpreting evidence,digging for antiquities,analyzing murder scenes,seducing women,killing teenagers,tempting fate,writing plays,eluding authorities
Doris Reed, 20000057, DS, writing up case notes,hunting monsters,causing mayhem,reading the news,manipulating political pawns,offering legal advice,deep-frying chicken,losing weight,spouting movie trivia,selling fried chicken
Steve Ross, 20000024, DS, tricking criminals,interviewing celebrities,crooning love songs,causing mayhem,promoting enlightenment,tracking down terrorists,solving mysteries,terrorizing sleepers,foiling the schemes of evil villains,singing pop songs
Rachel Nelson, 20000087, CS, fighting for democracy,test-driving cars,doing stand-up,starring in comedies,producing Hipbop records,knocking out opponents,commanding a spaceship,selling franchises,building airplanes,causing political scandals
Willie Adams, 20000040, CS, seducing women,delivering forehand slams,interviewing politicians,promoting Catholic values,making antisemitic remarks,writing plays,managing large development projects,directing animated films,leading armies into battle,knocking out opponents
Percy Walker, 20000465, DS, duelling acrobatically,running a fast-food business,nursing a messiah complex,counting calories,exploring the new world,engaging in bare-knuckle fighting,tracking down criminals,causing mayhem,seducing women,creating nightmares
Bobbie Reyes, 20000488, DS, maintaining salon-quality hair,promoting logical thinking,seducing toy boys,hunting demons,undermining authority,devising evil schemes,singing pop songs,inventing electrical marvels,interpreting evidence,eating people
Joseph Bailey, 20000091, DS, eating bacon cheeseburgers,preparing for war,finding clues,running for governor,fighting in gladiator arenas,smoking Silk Cut cigarettes,killing teenagers,singing pop songs,working for the forces of darkness,rescuing damsels in distress
Lovella Sumner, 20000262, DS, inventing electrical marvels,defending the innocent,wisecracking,clipping coupons,pursuing criminals,foiling the schemes of evil villains,promoting science,bending the law,cooking for friends,counting calories
Ella Mckenzie, 20000480, CS, promoting atheism,making political gaffes,making science fiction movies,writing plays,writing pop songs,writing rap songs,campaigning for the presidency,promoting conservative values,telling politicians what to do,commanding a spaceship
Jamie Mccormick, 20000187, DS, devising evil schemes,selling confectionary,running a kingdom,winning heavyweight titles,frowning at errant husbands,chasing terrorists,singing rock songs,cooking for friends,duelling acrobatically,analyzing murder scenes
Judith Wilson, 20000013, DS, writing bad movies,foiling the schemes of evil villains,killing rival gladiators,promoting conservative values,leading revolts,offering legal advice,chasing terrorists,extracting confessions,seducing women,solving crimes
Olga Copeland, 20000163, DS, applying science,stabbing in the back,killing rival gladiators,doing diet commercials,spreading Christianity,promoting the Dark Side,living amongst apes,arresting drug dealers,cheating at poker,smoking Laramie Hi-Tars
Cheryl Wells, 20000193, CS, promoting conservative values,constructing an ironic public image,winning boxing matches,leading armies into battle,playing basketball,selling comic books,starring in comedies,wielding political power,writing plays,organizing a putsch
Jimmie Gray, 20000167, CS, investing in real estate,wielding political power,amassing wealth,doing stand-up,enriching uranium,scandalizing polite society,recording pop songs,promoting conservative values,solving crimes,winning tennis tournaments
Vicky Blake, 20000102, CS, stabbing in the back,winning heavyweight titles,collecting rock samples,plotting mutinies,making bad movies,interviewing politicians,singing pop songs,interviewing celebrities,studying linguistics,recruiting dissidents
Marcus Walton, 20000438, CS, singing pop songs,eluding the public gaze,promoting socialism,leading armies into battle,funding a cure for malaria,leading revolts,attacking neighbors,teaching philosophy to future leaders,suppressing minorities,writing novels
