Marquerite Holiday, 20000349, DS, looking for love,promoting new technologies,solving mysteries,inventing electrical marvels,looking for hidden treasures,promoting logical thinking,grabbing power,pursuing criminals,solving crimes,brewing magican potions
Samuel Fields, 20000158, CS, making witty remarks,raising cain,hacking into computers,writing pop songs,funding a cure for malaria,singing pop songs,selling tickets,writing rock songs,test-driving cars,spying for the enemy
Adam Lee, 20000071, CS, launching cultural revolutions,opening new markets,producing Hipbop records,ordering wire-taps,making kitsch,raising cain,spreading philosophy,starring in Hollywood movies,spreading political gossip,selling tickets
Kimberli Whatley, 20000396, DS, looking for love,enriching uranium,working for the forces of darkness,chasing electronic ghosts,tricking criminals,performing magic tricks,studying symbols,bursting out of shirts,making documentaries,pushing dodgy operating systems
Mark Stewart, 20000081, DS, eating power pellets,spying for the enemy,representing criminals,tricking criminals,brewing magican potions,shopping for shoes,attacking consumerism,studying science,promoting wickedness,interviewing celebrities
Damon Copeland, 20000476, DS, treating diseases,seducing women,practicing good skin care,defending the weak,smoking Laramie Hi-Tars,preparing for war,foiling the schemes of evil villains,building a search engine,following clues,gossiping with galpals
Penny Grant, 20000425, CS, promoting conservative values,ranting about liberals,running assembly lines,ruling over subjects,making billions,writing rock songs,writing short stories,amassing weapons,currying favour,writing modern fiction
Laronda Early, 20000289, DS, devising evil schemes,cross-dressing in women's clothes,maintaining a secret identity,selling out,promoting logical thinking,working for the forces of darkness,reading Cosmopolitan,spying for the enemy,tending the garden,singing country music
Rachel Nelson, 20000087, CS, running assembly lines,writing modern fiction,singing pop songs,blanketing staff with memos,starring in Hollywood movies,raising cain,amassing weapons,promoting conservative values,promoting world peace,making dunk shots
Cecelia Dixon, 20000446, CS, womanizing,losing weight,funding a cure for malaria,blanketing staff with memos,writing romantic poetry,developing new technologies ,promoting conservative values,hacking into computers,writing rap songs,studying science
Martha Wilkins, 20000420, DS, bending the law,tempting fate,kicking ass,practicing good skin care,promoting science,seeking revenge,pushing dodgy operating systems,chasing electronic ghosts,brewing magican potions,fighting the forces of good
Lela Powell, 20000185, CS, launching cultural revolutions,shilling for rental car companies,promoting world peace,singing torch songs,raising cain,collecting treasures,making modern art,performing Web searches,winning heavyweight titles,running for the senate
Gloria Vargas, 20000495, CS, singing torch songs,leaking classified documents,opening new markets,knocking out opponents,seducing miltary officers,losing weight,amassing weapons,making modern art,winning heavyweight titles,singing jazz songs
Bridgett Shah, 20000317, DS, fighting the forces of good,leading revolts,suppressing minorities,subverting social conventions,interpreting evidence,keeping a diary,clipping coupons,bending the law,smoking cigarettes,defending the weak
Ernie Post, 20000233, DS, attacking consumerism,preparing for war,writing rap songs,tricking criminals,playing drums,engaging in bare-knuckle fighting,defending the weak,selling modern art,preventing crime,interpreting evidence
Carylon Whitlow, 20000338, DS, suppressing minorities,cross-dressing in women's clothes,enriching uranium,making documentaries,making soap,clipping coupons,studying symbols,promoting science,developing military strategies,solving crimes
Olga Copeland, 20000163, CS, promoting conservative values,making witty remarks,making modern art,making political gaffes,ruling over subjects,ordering wire-taps,making movies,spreading revolution,spreading philosophy,writing rap songs
Sarah Curtis, 20000468, DS, spying for the enemy,solving crimes,terrorizing employees,pushing dodgy operating systems,cross-dressing in women's clothes,duelling acrobatically,interpreting evidence,knocking out opponents,tempting the innocent,subverting social conventions
Sean Russell, 20000062, DS, cheating at poker,spying for the enemy,promoting conservative values,tricking criminals,ruining an empire,interviewing politicians,kicking ass,brewing magican potions,spreading revolution,practicing good skin care
Troy Jensen, 20000143, DS, hunting monsters,causing mayhem,unearthing ancient tombs,smoking Laramie Hi-Tars,solving crimes,starring in Hollywood movies,practicing good skin care,interviewing celebrities,interpreting evidence,tempting fate
Terry Flores, 20000055, CS, spreading revolution,ordering wire-taps,amassing nuclear weapons,opening new markets,writing poetry,spreading philosophy,campaigning for the presidency,seducing miltary officers,making witty remarks,test-driving cars
Val Zuniga, 20000342, DS, starring in Hollywood movies,performing magic tricks,playing basketball,smoking Laramie Hi-Tars,studying symbols,tracking down criminals,interviewing celebrities,building a search engine,eating power pellets,pursuing criminals
Arnold Little, 20000105, CS, making modern art,ranting about liberals,singing rock songs,promoting pacifism,singing pop songs,selling kitsch,running an empire,decrying secrecy,arguing against capitalism,singing country music
Carolyn Griffin, 20000086, CS, running for the presidency,cross-dressing in women's clothes,suppressing minorities,preaching to presidents,writing for the New Yorker,campaigning for world peace,singing rock songs,running the FBI,writing rock songs,selling military secrets
William Rodgers, 20000404, CS, promoting conservative values,campaigning for world peace,losing weight,developing cunning plans,producing Hipbop records,performing Web searches,ruining an empire,currying favour,singing pop songs,making dunk shots
Carol Patterson, 20000059, DS, studying symbols,pursuing criminals,commanding Roman legions,tracking down criminals,solving crimes,treating diseases,enriching uranium,making soap,selling out,leading revolts
Claude Curry, 20000200, DS, ruining an empire,smoking Laramie Hi-Tars,making movies,promoting the Dark Side,interviewing celebrities,interpreting evidence,casting magic spells,solving crimes,chasing electronic ghosts,appreciating vintage collectibles
Pamala Riddle, 20000363, DS, solving mysteries,reading self-help books,cross-dressing in women's clothes,starring in Hollywood movies,writing rap songs,looking for hidden treasures,knocking out opponents,fighting with swords,promoting greed,instigating rebellion
Jeffrey Scott, 20000063, CS, playing drums,spreading revolution,hosting automotive shows,winning heavyweight titles,frowning at errant husbands,ruling over subjects,singing torch songs,writing rock songs,funding a cure for malaria,enriching uranium
Caleb Perez, 20000450, DS, selling out,running a fast-food business,pursuing criminals,looking for love,playing Baccarat ,interpreting evidence,subverting social conventions,pushing dodgy operating systems,selling fast food,playing drums
Eufemia Mcduffie, 20000368, CS, starring in Hollywood movies,suppressing minorities,promoting new technologies,selling military secrets,teaching philosophy,womanizing,funding a cure for malaria,starring in sit-coms,wielding political power,playing pop music
Brittaney Le, 20000301, DS, starring in Hollywood movies,building an army,attacking consumerism,devising evil schemes,singing jazz songs,solving crimes,appreciating vintage collectibles,clipping coupons,cross-dressing in women's clothes,terrorizing employees
Diane Morrison, 20000453, CS, seducing miltary officers,singing country music,ruling over subjects,piquing public interest,wielding political power,chasing after women,blanketing staff with memos,amassing weapons,launching cultural revolutions,testing new technologies
